nationkey,n_name,regionkey,n_comment
8,INDIA,2,ss excuses cajole slyly across the packages. deposits print aroun
9,INDONESIA,2, slyly express asymptotes. regular deposits haggle slyly. carefully ironic hockey players sleep blithely. carefull
10,IRAN,4,efully alongside of the slyly final dependencies. 
11,IRAQ,4,nic deposits boost atop the quickly final requests? quickly regula
12,JAPAN,2,"ously. final, express gifts cajole a"
18,CHINA,2,c dependencies. furiously express notornis sleep slyly regular accounts. ideas sleep. depos
20,SAUDI ARABIA,4,ts. silent requests haggle. closely express packages sleep across the blithely
21,VIETNAM,2,"hely enticingly express accounts. even, final "
22,RUSSIA,3, requests against the platelets use never according to the quickly regular pint
