custkey,c_name,c_address,nationkey,c_phone,c_acctbal,mktsegment,c_comment
69900,Customer#000069900,UnzNj3vlC0v78W,12.0,22-926-457-4377,3620.6,MACHINERY,gular ideas dazzle slyly about the ironic deposits. fluffily bold packages sleep f
118648,Customer#000118648,"k5r,rkYexH",12.0,22-283-852-7682,2258.03,FURNITURE,iously even deposits sleep fluffily regu
133312,Customer#000133312,"pbCla9 uzMSp KrQH,0Eazko4",15.0,25-880-210-5041,6047.4,FURNITURE, requests detect slyly above the furiously regula
74126,Customer#000074126,,20.0,30-616-778-2404,,MACHINERY,ccounts. regular theodolites haggle car
96387,Customer#000096387,tM dDA2PO4P5dC2LsKu5,4.0,14-919-201-3796,4019.62,HOUSEHOLD,onic requests sleep. final requests according to the special ideas sleep caref
47816,,Hmj4NXsDR75q3UrG9NIzTY6dcT,,,,HOUSEHOLD,
123463,Customer#000123463,PQ5oQBhPA9yyR2FHxA0jdaJZZRpUb9,5.0,15-633-826-3285,326.48,BUILDING,"eposits are alongside of the final, ironic packages. blithely final excuses cajole slyly. blithely final requests "
118258,Customer#000118258,71VVTL6UpQeepzyPZxPXb3R7719U2tVtIGyVF,6.0,16-174-790-6367,3052.8,AUTOMOBILE, around the quickly final platelets sleep quickly daring pinto bea
3477,,,,,4315.88,,
43652,,Nt 5svD5GV,10.0,,,MACHINERY," requests. slyly bold requests are. final, unusual asymptotes are fluffily across the regular a"
1248,Customer#000001248,f0X68bItSl,,,6539.15,AUTOMOBILE,theodolites for the unusual deposits cajole fluffily final patterns. caref
38713,Customer#000038713,fdaC1RqlEiSYVS TZ9,3.0,13-847-632-7964,8352.18,AUTOMOBILE,ic pinto beans sublate furiously. furiously special pinto beans wake above the blithely ironic theodolites.
62612,Customer#000062612,dBWiX2lGwfspsie5yqvdrCELPqcK0kj,4.0,14-316-264-6610,2357.19,FURNITURE,its. furiously ironic ideas behind the furiously special accounts cajole under the special sheaves. fluffily final 
114200,Customer#000114200,FUWaYOZxT2I5LzbyYA,20.0,30-885-717-5858,5572.51,AUTOMOBILE,"old, final theodolites. regular, regular courts use carefully furi"
75536,Customer#000075536,Y0IsSE1lMiUlu8oYp,,26-630-447-9357,,,y regular accounts. quickly ironic accou
66970,Customer#000066970,"3as3bdIgnP4pe 8qPj,wfoBIhTDyUtb4rSM",14.0,24-105-984-3563,736.8,BUILDING,s solve regular packages. quickly regular requests shall boost final requests. requests ca
111791,,"MfpWkcMSyU5UlzPhQY9IqpHckHt0vh5GLNAiT,",,10-936-486-5924,,BUILDING,es integrate quickly carefully bold deposits. bold req
20309,Customer#000020309,1Ob2Dtq1Dl,,25-888-536-2932,,,ns. carefully regular packages wake furiously. furiously express pinto beans wake quickly. final pinto bea
40489,Customer#000040489,Dir2cNrRcha4RF5rBWrRRDB0x2VHyAEETZWs2,3.0,13-900-807-8595,7599.12,FURNITURE,uctions-- special requests doze. pinto beans cajole
9800,Customer#000009800,,12.0,22-787-927-5218,1034.89,,
73639,,,9.0,19-624-477-3681,,MACHINERY,
5029,,JCSfOA3tnckXifzcIrS53OQcwBnK3c,9.0,,6661.38,,ly among the asymptotes. bravely final requests sl
28538,Customer#000028538,,20.0,30-493-487-4574,4141.72,BUILDING,
90904,,,,34-780-657-5624,6644.24,,
148880,Customer#000148880,,,,,,"ke slyly according to the carefully express accounts. requests boost furiously after the silent, "
74853,,,7.0,17-297-909-3066,,,ve the final requests? bold notornis nag blithely blithel
20539,Customer#000020539,CrHTOW56sIAvV3,1.0,11-226-569-3628,3714.38,MACHINERY,taphs. slyly blithe accounts 
3968,Customer#000003968,Wz7nfTOB20CLXtHpBZZHf8jEe,15.0,25-368-367-5638,9035.45,MACHINERY,tions sleep fluffily along the stealthily slow ideas. deposits sleep; fluffily even ideas haggl
13497,Customer#000013497,FQIpYhzAkH0tfhiT95MIJGz0Ps,1.0,11-934-124-4904,-819.26,BUILDING,l requests use fluffily speci
91911,Customer#000091911,XphTxuqKy06VdhzJ2irZwS5vJAgMYBUIQiCLtzo4,12.0,22-589-900-8590,-998.25,AUTOMOBILE,efully special theodolites. requests wake about the carefully ironic packages. blithely final deposits 
26114,Customer#000026114,YLiSJJXNwVu5AzV8ZZvlpcEh2jSLoC6,21.0,31-837-571-1274,4887.98,BUILDING,ly regular notornis. bold requests sleep regular theodol
31310,,"K9hgo74i8obQM,B7A,RRe",,,6643.55,MACHINERY,
66142,Customer#000066142,gDRlqcM0YwD6,2.0,12-627-888-7357,560.99,BUILDING,are despite the furiously final requests. slyly regular packages sleep packages. slyly unusual accounts nag
143276,Customer#000143276,"2TVwMdPd5XAR5KYVE,EpHKkbzodPPNCZzVbC5bZ",17.0,27-259-691-4136,8985.17,HOUSEHOLD,itaphs. final pinto beans after the quickly ironic dependencies haggle against the regular foxes. quickl
144895,Customer#000144895,"1vMSYYS5 1NL 2IhL34,tZSQ2VLIZhDI2 H",6.0,16-817-835-7492,7767.04,FURNITURE,"al instructions integrate carefully ruthless, special foxes. instructions according to the idly fi"
99133,Customer#000099133,,,14-305-764-9528,2436.63,,
97792,Customer#000097792,,7.0,,7187.06,MACHINERY,
65609,Customer#000065609,L6B3TYmRbT9t5LKa5C,2.0,12-865-341-3685,5553.2,BUILDING,ely express pinto beans are ruthlessly in place of the furiously fina
24035,Customer#000024035,"HNU8SmGG03,t,dDjnomNA",24.0,34-591-804-7564,6389.45,AUTOMOBILE,thely among the carefully regular deposits. p
48732,Customer#000048732,Q6CFUkWM3AD6cH3m,10.0,20-112-520-7180,4590.14,MACHINERY,". silent, ironic packages wake along the foxes. excuses haggle. f"
136731,Customer#000136731,160P5XQC4rwg2WqsSUd5uxbn62n0jM4L,7.0,17-919-395-5699,9089.16,AUTOMOBILE,inal deposits are carefully across the slyly regular deposi
103567,Customer#000103567,ebYhM2DaoytDleTr4LiYC5nd7YcZE5v,,,,AUTOMOBILE,idly special packages among the doggedly pending pinto beans wake fluffily along the slyl
74524,Customer#000074524,"Q,63JuizyNGD6xfK",8.0,18-973-442-9434,4411.47,HOUSEHOLD,metimes around the carefully pending requests. special requests are across the
65215,Customer#000065215,Vxu9nfKmLU2Xb,8.0,18-498-747-1011,4982.39,BUILDING,ven deposits. furiously fluffy requests against the carefully pending pinto beans sleep quickl
51484,Customer#000051484,"j,KtD0zkAs39LRcB",8.0,18-633-273-8047,7823.6,BUILDING,ong the carefully regular packages sleep quickly quickly even platelets.
52527,Customer#000052527,rveQ1CDpL01oQrBbVPtng8lMp1g,1.0,11-130-776-8773,6485.48,BUILDING,"nt, even packages. carefully regular packages"
141788,,"luBRoc9zMFu,Z3VOfbjHGMwJ",,,,,
54160,Customer#000054160,"uZiJKBjgUBnE6E5,r",12.0,22-738-470-6608,171.9,HOUSEHOLD,lithely regular courts. quickly even platelets boost blithely blithely ironic pac
67026,Customer#000067026,wCnZPUI5HBxsjh4hwx9sP6vY8NgPOa3avxIDL,1.0,11-177-277-9158,-306.8,AUTOMOBILE,final accounts sleep slyly slyly even accounts. even foxes alongside of the 
117209,,"2KCsAsXH6,frO4UEJNs",,,,,
89149,Customer#000089149,"sUN9lag8l,KLa",1.0,11-827-580-7857,,MACHINERY,kly bold packages. fluffily even accounts kindle; slyly regular instructions sleep care
46589,Customer#000046589,"S,,bWFVqjcfZt10Uh0B1IfojzzS24RYO8dwEj",3.0,13-770-292-4357,4595.8,MACHINERY,", even ideas. carefully final accounts use according to the requests. even ideas are carefully. i"
70843,,,21.0,,3687.77,,"usly bold, special deposits. asymptotes "
50773,Customer#000050773,16iIv4GBFHuXOhDD,1.0,11-342-949-7564,533.15,BUILDING,ctions detect blithely about the even deposits. final packages snooze sometimes acco
125089,Customer#000125089,aOF2vv3vQQKE9JLjmJDCB,0.0,10-280-867-3260,2537.12,HOUSEHOLD,"ke carefully. ironic, pending requests about the furiously r"
2756,Customer#000002756,"43hjKTETxHc9X RHneJufsG,X,w3ERUE8qn",0.0,10-161-329-1143,1318.87,MACHINERY,lly above the furiously ironic ideas. 
96838,Customer#000096838,1xddrQZloFEwzPuWFfpWdveyyvizaa9p,22.0,32-126-147-8298,6350.28,BUILDING,kages. idly final packages promise fluffily along the fluffily silent deposits. carefull
19166,Customer#000019166,MKUa8lVH2CjF6w,13.0,23-695-728-7292,3059.61,FURNITURE, carefully final pinto beans wake carefully silent instructions. ironic platelets are c
4634,,"GOUf3hxHl51,hu4vAU4H17yJVOcw",,,1304.79,, furiously among the furiously final accoun
83163,Customer#000083163,"rF3h87BSoSCBTKzwewUOHs,Y1g 2",15.0,25-722-703-2387,2851.1,MACHINERY, bold accounts. blithely final instructions believe fluffily furi
79788,,"V5 XODEaFA2eRi pRtshrXNyaNDnLS hmf,",,,8114.7,BUILDING,
13004,Customer#000013004,"8x6nrJLzLfMpb,ox,nbS1xD9cfzPJ",13.0,23-784-493-6730,-525.56,AUTOMOBILE,odolites are quickly around the unusual packages. express deposits nag. asymptotes haggle fluffily furiously speci
81339,Customer#000081339,qWQgIq232yoX,24.0,34-974-886-3139,5666.36,MACHINERY, final instructions are slyly above the carefully regular requests. careful
55316,Customer#000055316,"c8MDOYIsYm,pB0zCLJANhRu",5.0,15-688-192-6600,8506.03,HOUSEHOLD,"counts. ironic, special accounts are carefully about the fluffily unusual courts: deposits haggle slyly i"
34100,Customer#000034100,"Rm JzC1DdqXnW9L4Ia7,kLYbOVUp6b",7.0,17-617-783-9481,7944.25,AUTOMOBILE,ackages: final dependencies use fu
94396,,1xsWjUKuYv,,,,,"instructions nag unusual, bold sauternes. special deposits acco"
96367,,,21.0,,,HOUSEHOLD,
73773,Customer#000073773,m5fp Nr38vJwMYWM77lrl651,22.0,32-832-489-3222,7146.39,HOUSEHOLD," carefully. regular, regular deposits are. furiously final requests haggle bravely evenly even"
99061,Customer#000099061,azztfxOzyqhiHDEbYI5YKdrCDG1Or9hjVP,3.0,13-565-458-7931,6399.9,AUTOMOBILE,c platelets. blithely even pinto beans cajole-- blithely bol
32082,Customer#000032082,yA3DRcIN5h5aS68pPQZ1IedCtA1d3zSsmhu1,4.0,14-754-212-7561,7156.55,BUILDING,en deposits kindle quickly regular platelets. regular theodolites along the b
81615,,,,,9392.56,,y. requests cajole carefully. carefully fin
56983,Customer#000056983,"81lY2mrmqSvp SDsHvSoNsd lrS,7omZKkseVr",4.0,14-327-332-3091,2990.0,AUTOMOBILE,"s. quickly final packages grow blithely regular accounts. final, final accounts across the fl"
92724,,Siokt4vYSiSRBOANK,,33-314-897-3061,,,
56139,Customer#000056139,"RnJPeJYOYSgCip9KF,Bg7TGpLhmrhEKrO v8h",18.0,28-403-339-6468,1826.55,HOUSEHOLD," fluffily. special, unusual packages wake fluffily express packages. regularly perma"
52002,Customer#000052002,"j6LcWsq3GhJcgd1d3Vo,G9vP",17.0,27-849-457-6911,5733.75,FURNITURE, foxes may nag slyly pending attainments. packages haggle ruthlessly against the carefully pending asymptotes. c
63493,Customer#000063493,XlzbK4tlJ2K714mjJi2UjMW2,,23-664-291-4436,463.4,FURNITURE,ly express courts affix slyly final requests. furiously final requests cajole careful
43719,Customer#000043719,"JzJKIBvAGgNf83BWqAF,iW0984Zbi",7.0,17-978-383-7774,2381.48,HOUSEHOLD,"st the express theodolites sleep quickly about the regular, final packages. furiously ironic "
644,Customer#000000644,"bfZrdZE0QHtMc,ksudO",18.0,28-489-845-4801,6183.15,HOUSEHOLD,"ke slyly alongside of the silent, even req"
135136,,,,11-131-502-2191,,AUTOMOBILE,pitaphs. slyly ironic requests cajole about the blithely bo
31932,,,11.0,21-112-552-7601,,,
50067,,bIqnj98bBFi44P,22.0,,,, courts. furiously idle requests boost bravely regular multiplier
148217,Customer#000148217,"KMgQNlfN81Qil1FeK2,377VCwBWtd",17.0,27-959-800-6310,2428.4,MACHINERY,"y pending packages. pending, final dependencies serve furiously-- furiously pending theodolit"
54353,Customer#000054353,,14.0,24-458-342-8929,1398.19,, packages sleep furiously. blithely pending asymptotes across the blithely silent instructions use according
129295,Customer#000129295,2BK1PnWEUQ0YwMSQRL4H,4.0,14-408-265-1673,4397.95,MACHINERY,o beans wake slyly. quickly regular ideas detect. quickly regular pearls haggle. furiously regular ideas afte
56411,Customer#000056411,hGiH8UbusCnO3WAxCzzTRWtu1Exc7DGxjFU,5.0,15-915-641-1640,9495.27,AUTOMOBILE, excuses detect blithely. final deposits boost boldly according to the 
21703,Customer#000021703,B6CwpUiMX2vUlQ a4F,11.0,21-782-488-1979,3840.29,BUILDING,kages. requests boost blithely. packages sleep ideas. carefully silent pinto be
84970,Customer#000084970,"E6N,CL7IZud7",9.0,19-358-245-4370,8526.62,HOUSEHOLD,cial accounts. ideas across the quickly ir
22521,Customer#000022521,,,15-697-229-7227,,FURNITURE,
64463,Customer#000064463,fKbaPSOwgu0Dfo2imd,6.0,16-438-998-4552,6788.31,FURNITURE,
141879,Customer#000141879,"yE35p cc1,X,REhc3dF7rdX8s",16.0,26-438-112-5446,8019.25,FURNITURE,ly special requests. furiously regular packages haggle blithely along the 
111486,,,,32-318-596-6868,,HOUSEHOLD,e blithely. fluffily silent instructions
90006,Customer#000090006,YqAf Wc6HTZaGg4Wx9URZRDQ,18.0,,9950.47,AUTOMOBILE,"ole along the regular instructions. fluffily bold accounts cajole blithely escapades. silent, bold accounts h"
63958,Customer#000063958,"kDZ0Z8oc,NTZgbMJ5",5.0,15-378-816-6094,2962.06,HOUSEHOLD,"g the final, regular instructions. slyly special deposits ha"
26139,Customer#000026139,9LSGt652ZGhZ4kKQXTA1h2He5,10.0,20-931-609-6117,9140.47,FURNITURE,lithely unusual packages are? slyly even dependencies cajole careful
6499,Customer#000006499,zXN1H4vSEbL VEvBO5lT8IICF,22.0,32-496-645-5422,4390.89,FURNITURE,"tegrate alongside of the final, final theodolite"
12355,Customer#000012355,HAYiMFCOGF nL0mOoVtwp,12.0,22-791-772-2580,1866.78,HOUSEHOLD," thin, even theodolites cajole blithely. regular, express"
8114,Customer#000008114,"2zQr4J ZaFYWpRDotclC1nQVJA Jis,z44VeE5a3",0.0,10-514-417-8902,-97.17,HOUSEHOLD,final theodolites kindle furiously 
105816,Customer#000105816,"ueNKBvPPJexg,LFgr7PBN",9.0,19-356-202-7280,2577.3,FURNITURE,ts cajole deposits. slyly ironic deposits haggle carefully even foxes? regular deposits detect slyly. carefull
70484,,21AKYBKMxpfl8e,5.0,,1361.88,HOUSEHOLD,
44845,Customer#000044845,Z2jfdmXHiHG9oozw0jJmxW 1,7.0,17-233-943-2823,2188.82,BUILDING,play against the ideas. slyly express pin
109124,Customer#000109124,pP4MDhunDKNwcHhubO9I,,10-876-911-6177,,BUILDING,the carefully even asymptotes haggle fluffily among the furiously ironic patterns. b
95588,Customer#000095588,cygE4z30QJOQwxwxzeS0iFcfC,7.0,17-138-696-2787,509.67,FURNITURE,", bold deposits against the carefully ironic theodolites unwind after the furiously ironic packages. blith"
2466,Customer#000002466,FPB8OdCdbpiSLzfiM1QThv,,16-464-726-3712,,,s. slyly ironic deposits after the express requests are furiously pend
30339,,7Zc33ez83ZyIo,13.0,,-275.7,,
106800,Customer#000106800,"iLrE5YbwS3P4xA 9TOgTDOrC6mkeSton,",3.0,13-100-649-7771,7396.49,BUILDING,of the silent requests cajole blithely against the deposits. slyly ironic theodolites cajole alongsi
7528,Customer#000007528,rVfaWyZRo0egtd0G9,21.0,31-775-470-3974,6890.19,HOUSEHOLD,"regular, ironic excuses maintain furiously slyly ironic theodolites. unusual ideas nag carefully withi"
138003,,O71bEgOAjcI4PGHwqXSACggq6kTQzoiWl,,,,,
12509,Customer#000012509,,,32-751-486-6602,6779.52,HOUSEHOLD,uickly at the somas. regular dependencies above the quickly bold 
135174,Customer#000135174,"wFfpHihxwp0,,0",7.0,17-577-274-4662,,MACHINERY,
6748,Customer#000006748,a8b2paF9T94UrLTiSzHSE38ZmxHL,17.0,27-580-967-4556,2410.88,AUTOMOBILE, furiously ironic deposits haggle across the slyly silent instructions. quietly ironic 
117807,Customer#000117807,"AIpV,ofgR18",14.0,24-698-781-3916,8295.02,FURNITURE,"ns wake carefully. carefully ironic foxes against the bold courts integrate carefully according to the ironic, fina"
132009,Customer#000132009,Rsdzfx5gxCBCl7du0dZ1J3N9RRgJT2,1.0,11-828-442-8030,2298.09,MACHINERY,e quickly quickly fluffy packages. slyly blithe packages alongside of the car
12024,Customer#000012024,,16.0,26-252-624-8194,,,
131084,Customer#000131084,OhXpXJwA 0CaKR7ih7sS7U8USl,21.0,31-531-422-6643,-248.67,MACHINERY,xcuses boost blithely against the quickly s
143352,Customer#000143352,vOftISGoxroFypsBW tSm,10.0,20-301-324-6275,3050.34,AUTOMOBILE,"equests. courts use furiously among the ironic packages. theodolites nod blithely dugouts. special, dogged do"
106344,Customer#000106344, hoWjeCDze6,10.0,20-208-177-7716,174.36,HOUSEHOLD,"s, final excuses wake slyly. final pinto beans haggle slyly above the bo"
82018,Customer#000082018,HH4WKRQNe2TQl9WbWR6i CG1,5.0,,,,
26463,Customer#000026463,"sl,Di1flga3umT6ELF",5.0,15-272-436-5310,-574.82,AUTOMOBILE,es haggle slyly above the doggedly even instructions. idly final foxes was slyly. ironic theodolites are acro
62411,Customer#000062411,igOCl2gS47s8h9eNaYMzAmpRjZORW,,31-559-163-7849,,BUILDING,
101145,Customer#000101145,7EC4EWVp6XYj01R,15.0,25-339-967-3602,5838.48,MACHINERY,lly. furiously pending somas about the accounts nag fluffily blithely express courts. furious
43660,Customer#000043660,"J,vaFfsloGRXDB30d0colEk9TpRJcoiaaz",3.0,13-963-521-7464,9237.3,BUILDING,iously special foxes. tithes sleep. regular excuses haggle with the slyly special instructi
116800,Customer#000116800,,,28-179-850-6601,2733.42,,
14455,Customer#000014455,WxlNhRFWOUVVIVPCZ7MC42aBl9ewkn2awp,17.0,27-188-447-4353,2232.82,AUTOMOBILE,ctions are carefully. bold foxes according 
146049,Customer#000146049,"FKigUMLwFAyqz1,rhaWLfCy60LdEGQNvnk",10.0,20-616-393-3790,5540.9,BUILDING,"ully across the regular, pending ideas. blithely regular requests wake "
24351,,u4OkvgvpKeIYre1lL hRS,8.0,18-306-448-8580,4147.72,,ep furiously above the daring
133979,,,,17-959-226-4953,2664.02,AUTOMOBILE,"final, unusual ideas sleep. regular, even packag"
9794,Customer#000009794,RXEezAaBFt7Py,4.0,14-484-815-8652,-355.93,AUTOMOBILE,"ular dependencies. express, ironic sheaves about the slyly unusual acc"
51328,,JFb1v4fXuK 1n,,,,,
16660,,"Fi7ItfdOlN82oVV9QjYSHVAy5T0lj,ILoOHKerGF",15.0,25-758-163-5481,6615.25,,
106015,Customer#000106015,,,,,MACHINERY,
65326,Customer#000065326,qPvFCDyT99 29,1.0,11-556-700-6743,1657.62,MACHINERY,en deposits after the slyly express ideas are slyly about the carefully regular theodolites. blit
134251,Customer#000134251,,13.0,,8768.79,FURNITURE,
19065,Customer#000019065,"HPCJsa3VrnAwfExZiMClR0G2,EvDImiObAE",10.0,20-658-988-5301,5004.51,BUILDING,le slyly blithely even deposits. Tiresias sleep among the blithely
71017,Customer#000071017,Ho261t6tsoyo8,19.0,29-914-513-9555,3549.37,FURNITURE, instructions around the final escapades are blithely about the evenly ironic accounts! accounts w
140058,Customer#000140058,STzI7KX Gd,12.0,22-812-939-5247,3125.36,AUTOMOBILE,"among the silent, pending theodolites. carefully ironic accounts thrash. fluffily bold excuses impre"
109276,Customer#000109276,,,17-907-936-7477,,AUTOMOBILE,slyly against the quickly regular requests. slowly ironic ideas are slyly. final packages haggle carefully
7553,Customer#000007553,idOxc55xe0VtTg tMPsd,8.0,18-105-755-3375,8009.98,BUILDING,ing to the slyly even dolphins. silent dinos nod furiously inside the furiously regular deposits. regular pi
81928,Customer#000081928,VnuRDSgnyUYaabKFR1srB4SFtrdk y5MfSJBMu,23.0,33-681-294-1890,,,
2324,Customer#000002324,"A66,HzSDrIXug9Q05F7iAx3Wo5DzqXpJK1",14.0,24-187-555-1463,4377.67,MACHINERY,s. furiously brave requests de
97964,Customer#000097964,vqBNi9BO5Blg ,5.0,,2153.98,,
117922,Customer#000117922,d9hXykU6V0LMNDrFEAJQeXrxtOUxLSbKgnE,6.0,16-861-696-6619,3187.9,FURNITURE,"riously against the regular, regular ideas. packages cajole according to the regular requests. "
38845,Customer#000038845,GaTBlX7SCkh12YK,7.0,,8451.83,,oldly final dependencies. packages along the final deposits wake above the busily s
45767,Customer#000045767,",8MAl5ZFbMFP",14.0,24-146-971-8672,6798.37,FURNITURE,"ven, final requests. deposits sleep ironic accounts. excuses since the carefully regular requests sleep carefully "
11582,Customer#000011582,X5GSxLhzlzt,,,2273.17,AUTOMOBILE,"ng the blithely special courts wake carefully regular, pending instructions. carefully express courts wake"
6697,Customer#000006697,0NTbi10hHKSxo,24.0,34-307-871-2967,6632.75,HOUSEHOLD,re carefully quickly final asymptotes. blithely pending packages cajole quickly along th
98675,,,21.0,,,BUILDING,ular deposits. express deposits wa
129962,Customer#000129962,,,,,BUILDING,
41372,Customer#000041372,vijdeL p47a1ZnkjcuvyKhHMRJV yOuHScY,22.0,32-866-487-3100,2558.15,FURNITURE,posits. furiously special ideas above the even reques
6708,Customer#000006708,mUhDV6NCOCJghkAjEX0Jo,12.0,22-281-780-5651,9900.11,,ly. ironic accounts wake carefully at the final pinto beans. slyly regular requests slee
33044,Customer#000033044,mricmll7WP5CM2gGKbN8Dgg,10.0,20-666-135-5621,1677.09,AUTOMOBILE,deas sleep furiously furiously unusual foxes. quickly unusual deposits cajole quickly. furiously unusual 
143163,Customer#000143163,L0SagQnyPjn1sJ9G,18.0,,,BUILDING,
66561,,CeBSD1M3owsUU4emZm,5.0,,,,
82514,Customer#000082514,"w2V,rmkzyG8LLDZ62Jq21PzJ",8.0,18-794-634-8925,9771.49,AUTOMOBILE,"c requests. final, even accounts about the ironic, regular instructions engage deposits. final, unusual "
120710,Customer#000120710,,,,,BUILDING,the final deposits. furiously blithe reque
31533,Customer#000031533,qO17VuxwFbCuM28Z,0.0,10-152-380-9820,2629.39,FURNITURE,usual deposits. slyly bold pearls cajole regular ideas. furiously express deposit
104093,Customer#000104093,"EJreOvONjjVNF2Ou,rP1qsPyMcifVJhFL30TfC",7.0,17-962-652-6459,1724.89,BUILDING,kages breach. furiously final platelets lose? fluffily special dolphins fr
65189,Customer#000065189,yrQy7B6dYcsXXWs9ly149LpuKiBJXoSL5MO8vv,9.0,19-471-141-8843,4933.2,FURNITURE, sleep ideas. platelets affix blithely. quickly ironic pinto beans haggle from the slyly final 
124101,Customer#000124101,,,28-726-811-9288,,,
139136,Customer#000139136,"k5KEUbVrb,Jp7ekeAMU6pazbJH6YZqAYzwaweX",23.0,33-624-768-8348,4907.04,MACHINERY,ng the quickly ironic deposits breach careful
45972,Customer#000045972,"Ze,lQWAOgxVEFs4T0v54VOqjXuUNA",,,-528.75,,
55615,Customer#000055615,FRUOX490uyzU8S,6.0,16-394-542-2214,2001.3,FURNITURE,es unwind carefully. permanent
130128,Customer#000130128,"2EYvHVwvPYTqV,zHJB6AlFG EO2T5wkqz0CW",5.0,15-163-918-6386,4625.38,MACHINERY,". special, pending packages integrate fluffily! blithely final deposits"
106070,Customer#000106070,RfG dt6cpqysMTc TS0hfizjX p9nN,12.0,22-728-381-6789,1161.19,HOUSEHOLD," pinto beans detect pending, regular deposits. slow, final dependencies haggle blithely about the pending requests. "
41991,Customer#000041991,",lu0NHRuwqVfF68oiO0dJLqsdkoJSxoJ",,,3145.58,,usly regular deposits among the requests sleep about the unusual foxes. quickly pe
18709,Customer#000018709,FE9i8jyo mijjCHVLEY4WiByq7S,20.0,30-690-107-9206,7414.48,MACHINERY,eas sublate. carefully express courts engag
133809,Customer#000133809,"SMFu5aC7PT3xUVZDolmt,AN9ksEj5n8 AFNei",1.0,11-716-303-4769,3372.78,BUILDING,ts nag carefully furiously regular courts. blithely ironic theodolites boost
124789,,,14.0,,,HOUSEHOLD," against the regular, pending deposits use slyly at the blithely ironic instructions. regular, enticing accounts "
101928,,EPB0r6K8jX597r5A4,,23-284-993-8875,,BUILDING,
52562,Customer#000052562,,,20-608-921-2202,,," ideas above the quickly special accounts are furiously after the requests. even, ir"
8348,Customer#000008348,,18.0,,6084.59,,
35040,Customer#000035040,QHjlQ7UuDJEUB89rd,24.0,34-530-397-4658,1514.76,BUILDING,mptotes cajole blithely around the silent foxes: packages wake r
137110,Customer#000137110,,,34-739-655-3826,,MACHINERY,
89471,,,9.0,19-582-718-4907,8677.58,FURNITURE,
117881,Customer#000117881,H8kgD7FPnktSq5XEooiOVs,16.0,26-613-894-7225,8527.46,BUILDING,ke fluffily. special deposits cajole furiously. furiou
137340,Customer#000137340,hi97TcurnsVkhKccy7Kh6rvzHMs3hs ZQw2vu,18.0,28-577-473-2889,1456.62,MACHINERY,olites. carefully even notornis boost quickly frets. slyly ironic somas sleep blithely depos
53078,Customer#000053078,Vav dAqAQD2WAPfoCKi,10.0,,,MACHINERY,"riously across the regular foxes. ruthless braids detect furiously. bold, ironic reque"
86047,Customer#000086047,"biQhN FR,DtxwHoKNIggIN ElzL",10.0,20-348-547-9501,7758.38,BUILDING,"ts believe furiously after the even, regular packag"
6058,,noUsJ1sGwBlm9KfvZ,21.0,31-818-798-9205,1401.74,MACHINERY,
128816,Customer#000128816,"Ltkl2sBcMHko,zGYZ6pTAQYT9flYRelMh 2",10.0,20-863-496-7376,-155.41,AUTOMOBILE,iously silent dolphins haggle carefully along the carefully final pinto bean
47062,,,17.0,27-991-838-2654,,HOUSEHOLD,sleep along the accounts. furiously ironic accounts across the dari
30171,,,1.0,11-799-236-5117,4336.21,MACHINERY,"ironic accounts unwind carefully alongside of the final, bold pinto beans. ideas cajole f"
61336,Customer#000061336,,,20-233-590-5031,,BUILDING,"cajole furiously. ironic, express depende"
50621,,,,15-830-889-2620,6278.71,,
77148,Customer#000077148,jtgxbWXWDacUSn4H07,19.0,29-289-652-1785,-480.21,MACHINERY,"tes are carefully furiously ironic requests. quickly regular requests haggle carefully special,"
6508,Customer#000006508,"Swm,c vbMg36c1z5,4fdBedBNG1OrfhsTPco",18.0,28-986-386-9035,952.0,FURNITURE,"ters are above the express, ironic dependencies. express deposits according to the furiously furious packages pri"
23426,Customer#000023426,"mrW9b028lsx12LKNvrzJosP9q,k6G8UVJaJSB",,32-433-211-5252,,BUILDING,
129701,,,,32-296-411-9921,,FURNITURE,
133519,Customer#000133519,FT7UV8jK5KUO48c1gjCsJFfL,8.0,18-251-415-9561,1879.29,HOUSEHOLD,xcuses haggle ironic accounts. furiously regular attainments haggle furiously after the s
12497,Customer#000012497,njqLk0xebQwIUgnDnoznqRykc,13.0,23-693-133-5140,3574.67,FURNITURE,use after the even deposits. blithely even packages sleep blithely. furiously even courts according to
127165,Customer#000127165,fOqXqPo1yL,3.0,13-962-554-1170,835.62,HOUSEHOLD, requests was slyly. final deposits use about the slyly idle packages. carefully express
142207,Customer#000142207,"6,UzljB g8Wh1WS597dHsnweCg7FliMpi",4.0,14-368-992-4121,8460.76,BUILDING,deas. blithely ironic accounts wake blithely against the silently enticing Tiresias. sly
86578,Customer#000086578,xk0K2rD9Y5ojkHYBWE71aSuk1wy PE,11.0,21-248-422-2467,-708.18,FURNITURE,ong the theodolites. slyly special asymptotes haggle slyly. quick
13614,Customer#000013614,7BYoZZPyndVt2WxEHV4n2Kvic9cRbdXzF3yQw,23.0,33-956-587-1188,,AUTOMOBILE,"xpress ideas. even, ironic accounts along"
76892,,jyhRS n3SdM4tlPX7e6JyQ3CzvUtwBj4wboA45,,,946.13,,
