custkey,c_name,c_address,nationkey,c_phone,c_acctbal,mktsegment,c_comment
132924,Customer#000132924,"wKNWF,dlaXeg9aYq304O03XEvENRnZFEHQFT",21.0,31-494-113-8648,8120.05,BUILDING,eans haggle pending sentiments. carefully bold packages wake always quickly
20901,Customer#000020901,,6.0,16-422-907-1574,-536.92,,
10160,Customer#000010160,zZ6WOgYgACF248GNTktiKM7,12.0,22-500-858-9986,5907.95,HOUSEHOLD,"theodolites are. even, regular orbits wake along the"
129680,Customer#000129680,"q2L,aO94wG26DyMgm5fX2",12.0,22-823-454-1312,7877.89,BUILDING,". even instructions cajole quickly carefully express accounts? quickly regular deposits wake. ironic, regula"
76600,Customer#000076600,uvc psLqcLmAz6dH,3.0,13-536-801-5117,2249.44,HOUSEHOLD,. slyly final ideas are caref
106479,,"Oj65wBPSWq8rj0x,",15.0,25-381-234-9421,,,
143889,Customer#000143889,rzhu9BnGjIxiZxa7C,19.0,29-553-164-4020,3073.49,BUILDING,le blithely final requests. ironic hockey players boost blithely even dependencies. slyly regular packages detect 
13279,,,11.0,21-631-846-5568,,MACHINERY,
53010,,JJToSowPpDWavGkNKE6D,2.0,12-130-863-1788,365.86,,e even ideas doze carefully unusual theodolites. final platelets according to the
77823,Customer#000077823,f9sahLuU cLATNIVV0Gd6JGZqJtkb3Yq4Gh,12.0,22-707-469-7708,3769.29,BUILDING,unts! furiously ironic requests sleep furiously instructions. f
36991,Customer#000036991,s0cBvBR5rAlW0uINxr5Agq30Q,18.0,28-982-131-1317,2497.66,BUILDING,iously furiously special accounts. slyly regular requests are above the fluffily express platelets. slyly 
34859,Customer#000034859,EkeOrrdbRDFVJUF1Y,15.0,25-252-917-1865,5517.86,MACHINERY,equests are blithely ironic ideas. blithely regular depos
45366,Customer#000045366,sQSmqyWJwHLQi48dqtK,24.0,34-345-667-7449,1036.08,BUILDING, hockey players use fluffily. enticingly final requests cajole 
148197,,,,,9953.99,, regular excuses among the permanently express dependencies are even deposits. requests sleep carefu
94685,Customer#000094685,"2IUHtSxvAV7 NVbr,BPWA,mGPl",,,-728.73,,"nding foxes are carefully. quickly final theodolites use. theodolites are even, f"
35563,Customer#000035563,qT4LhFhQhDXWJYyIaWL1sHO1n,12.0,22-276-951-1284,6462.28,HOUSEHOLD,are among the ironic instructions. furiously ir
45843,Customer#000045843,,,20-654-451-8684,,HOUSEHOLD,
106669,Customer#000106669,0sHN7HgGOh3PEAp,21.0,31-805-918-9921,-877.18,MACHINERY,us accounts cajole carefully bold instructions. even package
10650,Customer#000010650,"f3UkIRM,h9mDR3lkhr,BUCuiq4pVC",11.0,21-336-888-7188,6403.42,FURNITURE,ckly among the slyly bold waters
48807,,xlhppVYCnWR0N0UAmWdXv3,15.0,25-483-635-6131,9656.2,MACHINERY, after the express deposits boost above the
96656,Customer#000096656,KtQvngbghEP SJ,7.0,17-465-669-3756,4134.62,,
145401,,vCcjMssimDf9C5QMGEFkF,,14-545-587-1831,,,
142626,,,12.0,,2480.96,AUTOMOBILE,s cajole. furiously regular accounts affix carefully according to the carefully pending acc
2766,Customer#000002766,zr9K8FftllM3SNQDw,0.0,10-653-750-1662,3339.18,FURNITURE,imes special requests cajole furiously carefully pending requests; the
16516,,,16.0,,2070.08,,
20769,Customer#000020769,"qLT4VIKKkpN,k6ngc",15.0,25-266-940-8864,349.32,AUTOMOBILE,express requests. quickly bold waters serve furiously final packages. blithely bo
109350,Customer#000109350,"SNwzrtW8UarcMnzr8NSRrk,dOf bKuVqn6TRx",0.0,10-248-947-4217,1480.6,AUTOMOBILE, unusual accounts wake carefully carefully even ide
14488,,jiY2d3jeH37YEuiAoGrLkU0,16.0,,3273.08,HOUSEHOLD,"he carefully final requests. blithe, even accounts sleep carefully u"
53256,Customer#000053256,,0.0,10-456-839-3332,3886.31,BUILDING,regular platelets. sly requests boost furiously. furiously bold requests detect 
72781,,,,,3.84,FURNITURE,
7429,,,8.0,,,,
77154,,,7.0,17-481-125-8916,1894.47,,"ublate blithely special, sly ideas. carefully regular packages are carefully. excuses cajole carefully "
27701,Customer#000027701,"kaP9MKG,w8PhPOgTdLAn",24.0,34-195-920-4259,7483.51,FURNITURE,ndencies. carefully permanent dolphins are evenly
7334,Customer#000007334,UY37SdJKyv2ibytx,3.0,13-273-983-3651,533.17,AUTOMOBILE,ss requests. pending instructions detect slyl
142043,Customer#000142043,"TEo,mHppzvgK",8.0,18-184-776-7555,1982.38,FURNITURE, express ideas affix blithely. slyly even pinto bean
136,Customer#000000136,"QoLsJ0v5C1IQbh,DS1",7.0,17-501-210-4726,-842.39,FURNITURE,"ackages sleep ironic, final courts. even requests above the blithely bold requests g"
143840,Customer#000143840,BP3d QFABxX5hJsc7IaVnkVchI0Q,16.0,26-795-331-1539,7067.37,BUILDING,iously across the regular foxes. furiously bo
6258,Customer#000006258,CzJGapE7fxQx3x9eN A7O,18.0,28-429-156-3365,7221.2,FURNITURE, foxes haggle slyly slyly final asymptotes. slyly even packages wake furiously along the 
33012,Customer#000033012,8iSuLKfR7UyMtRWefV4syoKpdWwhFyu,24.0,34-268-867-6372,2909.35,BUILDING,heodolites try to haggle furiously slyly unusual excuses. grouches breach 
50411,,wLPZ34ADgCHasg16DTk4f5Cy,22.0,32-953-803-5022,5412.39,AUTOMOBILE,lyly regular accounts. carefully pending accounts about th
48440,Customer#000048440,YzF7SYl7VYU1muDbH7GToFuL32984Ly,,,5439.73,,
119704,Customer#000119704,Uc7Lzvf7OKn,10.0,20-386-767-9215,-377.4,HOUSEHOLD,bold asymptotes use quickly ideas? ruthless excuses cajole against the slyly even deposits. carefully regular patt
121305,,,18.0,28-560-214-7897,,AUTOMOBILE,efully unusual deposits. blithely regular requests boost above the carefully regular id
128407,Customer#000128407,UjhClu3WNWFNbNU,,,,FURNITURE,
149711,Customer#000149711,pi61GcT6qIbMc4zm4,23.0,33-320-956-5006,5580.52,HOUSEHOLD,s. regular requests haggle blithely slyly unusual instructions. slyly final asymptotes wake carefully across th
14596,,VzQp4Nm 0tppnb00J8IDVeA,21.0,31-697-458-4092,5392.66,MACHINERY,"nusual deposits. final, regular packages alongs"
81416,Customer#000081416,xmnsjIooTYN9YbxYBgDaHKzxieG,10.0,20-882-296-6910,1712.65,HOUSEHOLD,iously slow packages are slyly furiously regular ideas. carefully blithe tithes hag
15387,Customer#000015387,"e8DNC v38wzAkdzhffp,PPKLX3YlvAtDhZ9yAi",14.0,24-589-680-4115,5264.61,MACHINERY,arefully silent dolphins boost slyly into the carefully even requ
31905,Customer#000031905,NVkGxhyn2UNcANsXiX6Cdk,24.0,34-648-185-8393,8135.59,MACHINERY,ain quickly according to the express platelets. carefully unusual dependenci
32218,Customer#000032218,Q4QnXSN6OlXNkYvQD,13.0,,1503.41,,s wake furiously across the unusual idea
98621,Customer#000098621,SlrveEQ55vtu80NFMNM0UacdkU ZRjcq8Ga,1.0,11-844-586-8977,5761.25,FURNITURE,lly ironic accounts haggle slyly. regular packages wake furiously along the ideas. slyly slow pa
32142,Customer#000032142,f5QXwtBLn69gZr9zWZTgH36m NrKgBnKAoRjISu,9.0,19-165-915-7708,7307.65,BUILDING," quick, pending accounts boost fluffily regular, even deposits. even, unusu"
106507,Customer#000106507,"kVDlGwHBF,x3JndgCr,fYPsHqENk6fG",7.0,17-116-765-4393,4592.9,AUTOMOBILE," deposits use about the gifts! special, final theodolites among the furi"
48645,Customer#000048645,vMc zg6kmS12,18.0,28-387-210-3206,2354.31,HOUSEHOLD,e platelets boost furiously above the fluffily
91025,,,,,6440.18,HOUSEHOLD,ts kindle quickly special dependencies; sly
77947,Customer#000077947,X227mD4gFgh3Iy7fJL FUQVRriZqmO2fp,21.0,31-920-282-7987,3290.77,BUILDING,pecial accounts sleep doggedly alongside of the blithely express deposits. furiously unusua
104246,Customer#000104246,5IIOZCUoCZDFZWpjwF5mj44tE2D1nf8ZOGC0QZsy,5.0,15-780-396-2518,-511.23,FURNITURE,ly regular packages can sleep slyly alongside of the slyly even foxes. regular pinto beans sleep car
4466,Customer#000004466,hDUMzbbVk52V7UQcbmbHmghHn,10.0,20-340-545-5889,6163.61,FURNITURE, even pinto beans alongside of 
34629,Customer#000034629,iXN6G7LOG5,20.0,30-731-599-3371,591.66,HOUSEHOLD,e slyly slyly even attainments. ideas along the accounts are fluffily blithely pending requests? quiet 
77668,Customer#000077668,BChS8KSLOGeJWBBsFAdVdjGt6A1Xlrmg16u,7.0,17-911-191-1161,9592.55,HOUSEHOLD,as. carefully unusual deposits about the carefully ironic packages are furiously special
53957,Customer#000053957,,,17-331-694-4650,6521.78,AUTOMOBILE,ove the furiously ironic theodolites. final accounts alongside of the slyly regular accounts use carefully acc
133428,Customer#000133428,kZC4tyJrtEvPns,,,,BUILDING,ly above the blithely even dependencie
124718,,IR jDPNoOHke7PFrSXkr,,28-920-988-6595,,,accounts. stealthily pending asympt
81062,Customer#000081062,,15.0,,,AUTOMOBILE,
49756,Customer#000049756,,,34-855-269-1809,3522.75,,"fix across the careful, final deposits. slyly special excuses wake. theodolites wake carefully final reque"
74089,Customer#000074089,"KI6hr,2hVDJWzitQAmqQi",2.0,12-954-178-4142,3482.17,BUILDING,"he bold accounts wake fluffily unusual, regular ins"
116134,Customer#000116134,EbBgl0xSqUdRTDZQ9wDz73Pjx0xp9qmUCbqQN,7.0,17-901-601-4029,7728.94,BUILDING,"ent ideas against the final, unusual asymptotes sleep carefully carefu"
48832,Customer#000048832,"ptyJMFKhrPzzSgCA9nIZVgkqVAwx,kkXLTQtjJ",17.0,27-557-527-8176,,MACHINERY, the even somas. sly deposits sleep regular platelets. enticing accounts use blithely across the furiousl
67937,Customer#000067937,fy3xUz0hCnbhzz8YIL2LsdO,19.0,29-295-597-6202,3474.48,MACHINERY, sauternes are throughout the carefully regular pinto beans. regular ideas caj
10767,Customer#000010767,rt9u2evb6WvbONjVr9u1M,20.0,30-445-666-7092,4948.12,BUILDING," haggle quickly bold packages. blithely express instructions are even deposits. ironic, final foxes hi"
109448,Customer#000109448,YkHjArDMtmXMFkARcvJmXwy3a,7.0,17-429-125-3186,6940.22,FURNITURE,ously blithely even packages. packages sleep blithely. r
8011,Customer#000008011,zsNpaoY eVvqKbavk,22.0,32-392-994-7068,2887.08,HOUSEHOLD,s. carefully ironic theodolites sleep blithely. slyly regular accounts are quickly against the carefull
96821,,"BWe4cka0IGgth5Sa,lG9FGV",24.0,,,HOUSEHOLD,
16860,Customer#000016860,"TUre6jCS1U,sJO",11.0,21-350-509-1713,778.7,AUTOMOBILE,t deposits. carefully regular accounts against the pending deposits cajole careful
128020,Customer#000128020,"fhHly,UusJoGcTU5vi9lQ",,28-937-675-3202,,,k accounts use quickly! carefully regular requests are unusual plate
26016,Customer#000026016,,12.0,,7220.49,,
56168,Customer#000056168,JnoWQosXXX5pY ,0.0,10-528-726-6959,6354.03,FURNITURE,"le busy, special instructions. carefully express packages use slyly slyly "
117129,Customer#000117129,93PZ9nZwmea mIVgOL0sDxvfcUxOvT3I6lDZVsj,7.0,17-152-319-8280,3811.13,AUTOMOBILE,"y final accounts wake about the pending, pending sentiments. fin"
43079,,kvwI16VVJlYBHKk81BGUWeMcCNM2la4grcsHYj8,3.0,,,FURNITURE,
128598,Customer#000128598,,,,,FURNITURE,"dolites detect blithely pending, unusual accounts. slyly final theodolites "
54314,Customer#000054314,UqOjNmfo JFR pjOL9tx7vFJJR3fnwIlSOQ,1.0,11-995-334-1840,-548.19,AUTOMOBILE,"ng the regularly regular deposits. special deposits affix quickly ruthless ideas. ironic, even theodolit"
122916,,PKSfOfzFTcZb7,,,,FURNITURE, snooze across the special packages. fluffily special accounts believe furiously slyly ironic 
1447,Customer#000001447,"pHkyNkViDja,dZVNg4bEEbicpoHIVDZvtQi8RPl",17.0,27-452-251-2941,2718.02,BUILDING,"ously around the accounts. packages haggle blithely ironic, idle ac"
46647,Customer#000046647,wFnu45Xlo3H8iEISM pPr7v9Defjajz902RAJ,,,,MACHINERY,
73626,Customer#000073626,,1.0,,,AUTOMOBILE,
123671,,syz8q5mAHX,,11-278-259-4564,-92.92,,
103073,Customer#000103073,shM2sj6pprvs3e,13.0,23-567-290-3531,2584.6,FURNITURE,"eas boost carefully around the regular, regular packages. regular accounts alongside"
56276,Customer#000056276,,,21-163-747-2159,1980.22,,
106038,Customer#000106038,wz5HFvUFBv8Rqb OQVRN895mPGTswiA3,6.0,16-578-575-5170,469.1,FURNITURE,leep carefully against the slyly express packages. blithely fin
28620,Customer#000028620,1aa mjP8CM4ct,23.0,33-643-672-1351,2878.3,AUTOMOBILE,refully enticingly regular courts. carefully final theodolites haggle requests. carefully pending instruc
56941,Customer#000056941, mh5crtVfXMl41S8xIq,1.0,11-516-696-2419,5918.5,HOUSEHOLD,"ecial, final packages boost around the ironi"
38308,,,,,,HOUSEHOLD,
19337,Customer#000019337,GxIAV7oAm5YtsMIvlWFjEx34JcMRUF2rJt,,33-542-800-7817,,HOUSEHOLD,ronic accounts. blithely final platelets wake along the silent pains. 
39562,Customer#000039562,6Oe5xfIaM Z2FNGl,21.0,,,MACHINERY,
109530,Customer#000109530,cpx1ngasDgAe6WG4Frw,15.0,25-389-703-5087,,HOUSEHOLD,"l, pending deposits hang. regular, ironic requ"
54090,Customer#000054090,"GYzGj,8lMkqXBBBsoZX AE2y",,,,,"deposits. final, pending theodolites sleep. fluffily even deposits wake slyly pending dugouts. slyly pending a"
2201,,,8.0,18-195-800-7314,,,"ns dazzle; express, even instructions wake furiously above the furiously reg"
94994,, jq6rf76BLzklf 5S3DRxGNdic90Tzk,0.0,,,AUTOMOBILE,
64620,,dHbd1693UHtv8DUCGWdqYYQO0ysuxJT,14.0,24-417-853-1443,,, bold deposits cajole furious
27482,Customer#000027482,"Yeajqy p tNi5S1,85fDEC",,,9923.04,MACHINERY,
77986,,,,,8827.53,BUILDING,
19525,Customer#000019525,"8MZxacZkFxM,jEN",24.0,34-209-702-1335,2448.48,BUILDING,oss the blithely quiet theodolites. slyly even ideas along the quickly express dependenc
113762,Customer#000113762,lDDdJ0WODZe,9.0,19-950-412-5225,3329.45,MACHINERY,pending foxes use fluffily. ironic accounts wake-- express i
114462,,,,30-114-715-8897,,HOUSEHOLD,
106255,Customer#000106255,"X3oS3d6Lf3,,DvtjKS7wcA ZNjkvTd",15.0,25-845-127-2238,2341.56,HOUSEHOLD,l deposits. slyly bold requests wake 
69397,Customer#000069397,"uzJwl84zx5Clc,HuaX0",,,8855.06,,osely express accounts. dependencies was slyly among the quickly bold packages. foxes mold carefully slow inst
56220,Customer#000056220,yO3A4xDdawvI72q0qTRyeVNmVFzk,23.0,33-356-813-1745,4874.01,BUILDING,eep furiously according to the blithely regular deposits. even foxes wa
43743,Customer#000043743,,,,,MACHINERY,kly even asymptotes. deposits cajole quickly. regular platelets 
140792,Customer#000140792,PA8yToG1ZbU0 Fdbeyn J,,,-282.34,," foxes cajole quickly regular, even warthogs. carefully pending foxes poach. bold requests among th"
40900,Customer#000040900,EboeONxoL4WndUYE25CVDeRsHi2V b8,12.0,,,MACHINERY,
6192,Customer#000006192,oI8CXoK1w9PnZDUEbvj,0.0,10-276-595-2077,7179.63,BUILDING,ly bold decoys are slyly. slyly even epitaphs around the regular requests cajole at the blit
111166,,"oGaoPvg2sRZAPkXgQu,,sUK",16.0,,,,
104693,Customer#000104693,fB38lThFDRWQWRKzPat3P,8.0,18-194-310-5704,1332.05,AUTOMOBILE,"sleep fluffily. slyly regular deposits cajole bold, unusual deposits-- foxe"
52290,Customer#000052290,,,,4197.34,BUILDING,y even decoys sleep across the quickly final asympto
129997,Customer#000129997,IXHqiCHQhy,24.0,34-402-253-5780,6285.45,HOUSEHOLD,e furiously ironic dugouts haggle after the slyly regular pinto beans. even dependencies serv
37819,Customer#000037819,,24.0,34-859-166-5069,162.94,,"ly express packages. final, ironic packages wake slyly. spec"
94869,Customer#000094869,3nCybVAheKDXRIde5ET5kDnHtwioMJaJxxE,8.0,18-655-328-6442,8920.7,MACHINERY,nts. slyly bold realms sleep furiously furiously ironic packages.
145778,Customer#000145778,huJzsmRa1Fku48ps6,7.0,17-211-193-1847,9618.0,MACHINERY,eas. bold deposits hinder carefully among the bold instructions. slyly special foxes cajole fl
69158,Customer#000069158,"U015t6MfdgCXzC63L,g,2vwl8JgM58lI",9.0,19-850-336-9750,7828.36,BUILDING,ly special ideas wake carefully permanent deposits. slyly bold accounts cajole carefully alongside of the bl
70497,Customer#000070497,k86B07VJjkEFs3a13Zs,17.0,27-165-962-6185,2236.68,HOUSEHOLD,"eposits. blithely even requests use slyly slyly even deposits. silent, silent accounts sleep express packages"
100393,,,7.0,17-253-981-1808,,AUTOMOBILE,
95036,Customer#000095036,2uwyBHCGXK,22.0,32-608-326-4098,7703.44,MACHINERY,"to beans sleep carefully above the even, express re"
132001,Customer#000132001,"pzzZVXKyF1HQobb96SCrSqHQ0Xv,zkt",6.0,16-780-946-6053,7094.42,FURNITURE,"ounts kindle unusual instructions. quickly final somas according to the regular requests integrate regular, pending "
62906,Customer#000062906,"bdDiX6XqX,zbr6k",20.0,30-540-416-6283,79.54,HOUSEHOLD,ole blithely. asymptotes use carefully carefully ironic accounts. slyly even deposits nod slyly among the slyly
57187,Customer#000057187,,0.0,,,,
4033,Customer#000004033,ZmkpTc rM0B,12.0,22-211-761-6750,7924.97,BUILDING,omas wake carefully final foxes. bravely even accounts
14481,Customer#000014481,,,15-924-555-3094,2976.14,,
117470,Customer#000117470,UgRfztFaOmRdfQmtbWJRn,,13-886-718-2962,,,". thinly even pearls lose slyly. ironic, express requests are bl"
53450,Customer#000053450,"WeaBV pi9W,NRZ3h35DKu0q66wfKnXLh",9.0,19-263-556-5577,7165.61,BUILDING,sts. quickly silent dugouts haggle carefully. regular foxes boost bold packages. accounts bo
134619,,,21.0,,3515.72,,
34097,,"NvTYVaUx,gndAt",20.0,,,MACHINERY, carefully bold instructions sleep carefully regular packages. bold dolphins cajole carefu
145666,Customer#000145666,LEcADV8At00Q34,22.0,32-957-309-5984,3674.71,AUTOMOBILE,refully express deposits. slyly 
127582,Customer#000127582,OGMDW9l fh,,,8796.93,MACHINERY,
55762,Customer#000055762,pREkQ268V2UUAzJ,1.0,11-726-569-4085,5577.72,FURNITURE,tes. packages sleep ironic accounts. ironic g
80972,,,,,,,st the ideas; blithely ironic foxes wa
90832,Customer#000090832,,1.0,,3939.11,,carefully pending accounts impress. accounts poach. furiously ironi
101158,Customer#000101158,"Ol8biMygWDe,mQxFSN",1.0,,8315.83,,
84627,Customer#000084627,,19.0,,4369.73,AUTOMOBILE,nic accounts. regular deposits sublate packages. quickly express theodolites around the 
21267,Customer#000021267,"r0WKoDuDLguU0mjnmL5VUA,rYvm",18.0,28-274-337-7263,618.83,BUILDING,pecial tithes integrate furiou
82076,,,5.0,,,,
34158,Customer#000034158,,,,8231.66,AUTOMOBILE,foxes. express packages integrate quickly. slyly regular accounts sleep fluffily. bravely ironic foxes sl
145949,Customer#000145949,NMq uUX5PI8PR,12.0,22-637-790-2411,-144.26,MACHINERY, of the deposits. slyly unusual requests around the blithely special asym
102469,Customer#000102469,UzjILoJQG9,12.0,,7363.71,, unusual requests boost blithely pending packages. e
148512,Customer#000148512,MpRHs97A26AlPvf34dEHP4v,1.0,11-544-849-5637,,,ickly thin packages. quickly special packages sleep slyly along the i
23182,Customer#000023182,"8mVjNwK5,ascUXY 5",23.0,33-377-415-9410,4739.95,FURNITURE,s among the slyly regular forges cajole deposits. quickly sly packages nag above the
121609,Customer#000121609,",UHGAqpJtS2Bf3vDj",22.0,32-612-215-5997,8198.7,HOUSEHOLD,"egular, ironic requests wake carefully. final requests sleep carefully fluffily ironic deposits. furiously silent "
117259,Customer#000117259,qMedgwYcy26tBUz1pxxGjDI,24.0,34-214-850-3570,9022.4,MACHINERY,ly even frays nag furiously fluffily pending requests. regula
8944,Customer#000008944,"RQReL nQzdt7YjYbbLm3,Q15cT86CXTv2YZHAZq",10.0,20-831-475-8476,3398.84,HOUSEHOLD,"ven deposits. busy, regular packages sleep atop the fluffily final requests. carefully ironic packages cajole acco"
56246,Customer#000056246,RVeA7b7YL2Noy06cTl6S45mryut,16.0,26-132-952-7795,2337.57,MACHINERY,telets sleep slyly furiously unusual dolphins. slyly special 
142689,Customer#000142689,,,29-694-613-2392,1347.63,FURNITURE,
5056,,,15.0,,,,l requests cajole quickly furiously ironic packages. packages among the f
136232,Customer#000136232,,1.0,,,MACHINERY,
79818,Customer#000079818,cgPspWH3uubQ8uC5B0xrdwezUpADQhyEMPrxlgq,2.0,12-465-853-3771,3589.0,MACHINERY, fluffily even deposits sleep slyly sometim
119476,Customer#000119476,sG7xCRjvCFKqhfDVW2C26WYOrr,14.0,24-145-428-8152,9401.78,MACHINERY,ic escapades! deposits above the unusual pinto bea
106814,Customer#000106814,"5Azp,Q2ueg,6QO77",2.0,12-877-785-3336,1008.78,AUTOMOBILE,"t, special accounts. finally express accoun"
136919,,qjrK1Pd1GdsGgcsCXYKnUfPPQ ER41RGqGxIOJHg,,26-282-479-7493,,AUTOMOBILE,furiously special requests ought to nag furiously a
21791,Customer#000021791,0IOWemRH6X80MG3QQjhqU,,11-560-917-9370,9145.86,FURNITURE,ove the never ironic pinto beans. fluffily final p
906,,,,,-613.45,,
146249,Customer#000146249,"UMSQE,Zbb2gg5T7CBHGo7WdeWburFipVck4O0",11.0,,-371.35,,
20154,,"o79HVK KdulIm8G,Vo3vOND5O",12.0,,1286.36,BUILDING,
135283,,iOMyJSkf4KvhHk,,,,BUILDING,sleep quickly. slyly final accounts about the blithely regular ideas haggle blithely along the
79169,Customer#000079169,"Sk,DTrDZdkELCVy1wjvg95WUcFl1a,T6uAwoos5",17.0,27-515-442-7692,8829.14,MACHINERY,", express frays use. quickly final instructions run across "
64235,,4RixvPhNrwDF,,,7769.19,,
26312,Customer#000026312,9qneeobgAuM3oW8T73G,24.0,34-323-124-2338,1746.44,BUILDING,jole slyly after the pending packages. carefully fluffy reque
35269,Customer#000035269,"1YVOWJ5GZ,HKDAzyh2K",9.0,19-394-549-3504,7604.14,HOUSEHOLD, unusual packages sleep. quickly final instructions after th
96344,Customer#000096344,14cBL13NEXtMOl0MLWevEg2LaLhuxcmC,16.0,26-147-583-6518,3452.24,AUTOMOBILE,"e ironic, special packages. quickly thin asymptotes haggle furiously about the slyly express requests."
6731,,HpEXXgDmsqIPyVb FXeWbadti,,12-283-284-3677,7639.55,MACHINERY,
42619,Customer#000042619,"YUUHZx,xq2MPHk5vSi7,NDBGkj6sK67",,34-441-437-7237,,MACHINERY,
139186,,"NUijZ,Q39YyIlgm5BBQsWyoF",,,,,
108969,,,,22-886-617-2449,,,
75890,Customer#000075890,xIhnGu75HIJMGOilacI2LfDkErkYkDUdYNn,3.0,13-384-930-1286,4584.76,HOUSEHOLD,"owly. express, final requests above the unusual instructions haggle slyly across the ironic deposits."
25660,Customer#000025660,aYTcJAD31Wl2lxiwWkrJaEilaHfN,22.0,32-165-852-3441,9333.94,FURNITURE,alongside of the packages. carefully regular deposits acc
40192,,,12.0,22-283-384-5116,,,are. boldly final pinto beans nag slyly requests. slyly special foxes poach after the carefully final requests. ca
15949,Customer#000015949,98iPVSDn4TYKDr3CX4Fez07,17.0,27-138-407-7149,4357.83,AUTOMOBILE,"ng foxes wake against the bold, final accounts. even acc"
121733,,"aPKMYzEE3jQ6qJz,aP9LU5Lzx,UnFONNUGXou",,22-270-612-9757,-192.72,MACHINERY,
41828,,"FORX23qOsWdYV,8NHqjakg 8MpiQD0gxJ1z1N",,,,MACHINERY,gle quickly pending foxes. furious accounts sleep carefully according to the carefully even accounts. bol
92561,Customer#000092561,"RREJYgq1NB1HjgqbIayL,3s",2.0,12-337-802-9880,9161.6,AUTOMOBILE,g instructions across the pains nag blithely blithely silent decoys.
130946,Customer#000130946,"iTvFzy1NpIAxKvdEgnUaKefbugjAcp9,wnS",23.0,33-975-743-7973,9706.69,MACHINERY, quickly ironic deposits. carefully regular epitaphs sl
1769,Customer#000001769,mrche55tm5KGuJb6lGWqCeKKIlZ rj4,10.0,20-708-644-8998,8457.18,AUTOMOBILE,"furiously silent packages. bold, bold theodolites sleep quickly against the quickly ironic theodolites. slyl"
106897,,,,30-859-826-9851,,MACHINERY,ily express accounts. furiously final instructions wake al
21111,Customer#000021111,23XIXcTYO3RrHZ3u3075u2dvMdO0pUod6xnh3,21.0,31-236-893-1915,4980.13,AUTOMOBILE,usual platelets after the express accounts doubt against the care
7752,Customer#000007752,"9m,uqy8ed0ziuVfo,kD4QYcwVJqZHuJxpWPlwAH",14.0,24-742-733-8570,4621.98,FURNITURE,cial ideas? instructions integrate carefully according to the special packages. carefully ironic theodolit
91597,Customer#000091597,ZF3P I46Lyr9,20.0,30-319-202-4638,8161.67,AUTOMOBILE,s haggle. express packages affix? furiously bold packages s
746,Customer#000000746,"JOKj8N2QKUm8Gi,F4qX0fLVy",20.0,30-154-354-9928,1164.46,MACHINERY, final theodolites. final pinto beans haggle-- furiously 
57895,Customer#000057895,Z YXmhZOezmCzN6,10.0,20-137-185-2175,9929.17,FURNITURE, instructions sleep about the fi
110909,Customer#000110909, UiOE6H7Dt9lbWi1irsNwAl07A1E ,12.0,22-290-838-3567,982.93,HOUSEHOLD, pinto beans haggle fluffily according to the slyly regular hockey players. even p
63845,,,15.0,25-428-941-2031,,FURNITURE,
87646,Customer#000087646,yeAZeau9ykDSaAjYai96bvR2LZwONXeOmR1Ju,17.0,27-311-874-5859,317.01,BUILDING,"ts. blithely even accounts detect even, unus"
48279,,N2b3z5t69mbRXYKPxQQQS92XctuCpEkzId6,12.0,22-226-945-9282,3671.03,BUILDING,
46244,Customer#000046244,,9.0,,,BUILDING,"s the daring foxes cajole blithely unusual accounts. final, bold excuses "
58819,,KZ4MK34Pi1TGeBOHAzqXaWW,21.0,31-494-554-3479,,BUILDING," ideas sleep. blithely silent packages wake. furiously express excuses wake. special,"
28583,Customer#000028583,"PNf0XwIDO qO18PvoyhDe4bslex,t",19.0,29-989-859-8461,6900.32,BUILDING,foxes haggle blithely about the ideas. carefull
127718,Customer#000127718,e5zMVPkKOEbR1hiAxQWQBz2APKTg2Glgwwv9T,3.0,13-771-822-1858,5335.23,FURNITURE,le furiously even packages. blithely ironic
118425,, 2G1ZBPGdE7QYJ8Uf4KAz,15.0,,,BUILDING,
24400,Customer#000024400,,14.0,,,,ng requests wake among the slyly unusual packages. furiously final instructions above the slowly unusual pattern
36754,,7KvtZ7kcUOsxPgLvsRghI,,24-719-816-2983,,,
133369,Customer#000133369,,,12-914-605-1260,,BUILDING,
22737,Customer#000022737,"OSpwef98FvO,K0L,5oXkL",7.0,17-740-974-1338,8941.84,FURNITURE,s slyly. furiously regular foxes against the regular theodolites haggle boldly final asymptot
105693,,,,,9008.62,," fluffily final requests. quickly regular notornis are. express, final requests boost against"
39728,Customer#000039728,3yIYLHv50uMi1zDte D4,0.0,10-721-928-5241,2104.89,MACHINERY,y slyly final theodolites. quickly express packages sleep fluffily. car
68609,Customer#000068609,",Ot0EWNWkUZiSyDn jCro9L3KA",24.0,34-960-303-8843,-371.01,MACHINERY,accounts haggle carefully. carefully permanent accounts wake. ca
11650,Customer#000011650,PuklkOc QFG,,,,,ironic sentiments wake quickly about the furious ideas. slyly bold accounts sleep carefully. slyly p
147464,Customer#000147464,M0KxR8IK0lHSMKRyIk,9.0,19-493-807-8220,6460.99,HOUSEHOLD,"ly silent packages are carefully careful, regular foxes. special theodolites kindle"
140045,,"VRa GrfovCb9UmxRDmT2x,Y0tmGMn",8.0,18-183-759-9499,6538.1,MACHINERY,
52022,Customer#000052022,"umYMR4alBUkj5Z0TCgyKn1nWd,kyq",11.0,,2324.17,HOUSEHOLD,
