partkey,suppkey,availqty,supplycost,ps_comment
5690,8191,395964,561.32,imuiqlnlne
39702,316547,683259,273.19,qjgnchfayx
145267,2810,9141,349.39, bold accounts are above the ironic deposits. pending theodolites alongside of the carefully pending deposits cajole careful
29543,2046,3742,864.01,c theodolites wake unusual sentiments. furiously even requests affix carefully quickly even i
55501,23549,6434,316196.6400642698,nzwzapjeua
42232,2233,687230,826.62,dettfzvvhr
54520,7026,7776,614533.3393072888,jrwxkiyjgm
61296,6309,6750,849845.8862180468,"deas are about the enticingly regular deposits. bold, ironic asymptotes eat furiously blithely regular accounts. enticingly regular requests haggle"
55351,68950,9076,640735.6339123094,epaptnyobm
187661,7662,1215,368.74,ronic accounts. slyly pending theodolites along the carefully final accounts wake blithely fluffily ironic accounts. blithely ironic requests must have to cajole sly
131857,4371,1827,26.74,"ideas sleep. bold, special pinto beans cajole fluffily bold foxes. requests haggle blithely furiously regular instructions. blithely even packages breach slyly express ac"
15005,5006,120945,516580.8322257982,fiplwyibgw
78932,556783,3995,8.5, quickly ironic requests at the ironic accounts use c
24803,10993,5190,989.83,s the furiously unusual accounts. quiet accounts wake quickly. slyly express accou
77099,2114,4487,833.21,uests are fluffily stealthily ironic foxes. quickly bold grouches along the fluffily final accounts detect blithely carefully bold requests. slyly final pinto beans above th
189752,4789,88202,205.49,"ependencies. slyly regular packages impress. carefully unusual deposits nag blithely final, regular dependencies. fluffily silent requests sleep slyly. slyly final "
32119,469860,166422,883.85,vzsoenupgd
29182,4187,1824,491.15,"ages. furiously final asymptotes could are blithely. express, unusual dolphins sleep slyly furiously si"
173155,198823,679854,244.85,emolepvwnf
188239,758,935983,87269.91174739141,lbdqchrgjp
136636,6637,9087,787.68,mptotes affix thinly above the quickly bold packages. daringly ironic depths haggle daringly. slyly pending accounts nag along the carefully even theod
197346,7347,7935,700.73,ey players. furiously bold pinto beans boost silently above t
181835,802781,602279,968110.1135480207," regular dependencies. furiously regular accounts wake quickly. carefully ironic asymptotes wake idly slowly silent instructions. brave, silent requests a"
113125,3126,6696,423157.67622290226,iakrtqktwk
42938,5443,2194,929.87,"es are among the furiously regular dinos. express, special foxe"
55175,5176,3994,244.37,osits. carefully ironic theodolites after the regular depths haggle carefully final accounts. carefully special theodoli
15159,859435,676108,380509.84511034837,yylsbeklod
156350,817300,5556,764667.924811908,gxpimfqhub
182288,2289,4805,735.37,ly regular dolphins sleep carefully regular requests. requests across the even patterns
179967,5002,626,786.31,"s affix! ideas wake regular, permanent ideas! ironic accounts boost carefully about the enticingly regular accounts. permanent, express re"
88922,3939,6244,971.67,"ests about the blithely final frets boost slyly except the regular dependencies. fluffily ironic accounts along the final theodolites use even, regular packages. ironic requests w"
40193,194,889,942.15,tsfitquelm
194457,2015,228028,223114.79039270477,uests hang carefully blithely special instructions. furiously final theodolites are. furiously bold packages are fluffily even theodolites.
187629,728056,542,835.15,ly ironic excuses. final packages haggle furiously. regular requests are quickl
42820,7829,4348,814283.9401566165,nkiwnlihhi
58656,1162,3151,106.63," breach silent ideas. slyly final theodolites use about the ironic packages. regular theodolites are stealthy, ex"
138349,5889,9437,336.99,press requests wake carefully final platelets. requests wake furiously about the accounts. ironic deposits detect carefully. foxes ha
43176,5681,289383,793393.2770526252,"d packages? unusual, regular ideas haggle quickly through the ironic, regular accounts. slyly express requests wake furiously car"
58808,1314,5430,433.36,eaves sleep furiously final platelets. express ideas cajole daring frays. fluffily even foxes boost furiously. pinto bea
33831,1341,2726,819.12,s wake. packages use about the special asymptotes. final dependencies are quickly furiously regular accounts. fluffily regular packages at the even instructions us
3625,1126,9912,257.7,regular excuses. silent pinto beans sleep furiously. busily special deposits detect slyly after the carefully even theodolites. slyly final requests are requests. quickly exp
57599,2610,629662,403.42,hcnsevbjck
148254,791315,1268,402560.7082677467,aggle alongside of the slyly final asymptotes. slowly final ideas mold unusu
179110,4145,3722,92.33,detect slyly alongside of the silent instructions. carefully close platelets integrate
53632,543151,322311,720.6,ncxdnvaxpx
19805,2307,7594,108.27,"bout the special, final asymptotes: regular, special foxes are furiously. blithely regular requests sleep fluffily. theod"
65652,5653,848499,762.55,"iously bold ideas wake slyly ruthless theodolites. fluffy, final accounts according to the furiously regular accounts wake "
23234,3235,227055,588467.7653004546,etsulpuwmg
84783,593292,660847,419.13,cdcrqdisvk
38069,70518,4983,882.89,refully idle foxes around the fluffily express instructions sleep fluffily
27353,4860,8806,356.93,", final attainments according to the express instructions haggle carefully after the express dependencies. slyly special requ"
159775,7321,1532,826.9,"round the regular, ironic packages cajole slyly up the furiously express "
8956,1457,1603,143.18, engage alongside of the sometimes special foxes. fluffily unusual foxes nag ironic deposits. slyly pending theodolites cajole. sl
36289,641192,380640,852.45,zffehxzqdo
186957,1994,9463,486.18,deposits. final accounts boost furiously bold instructions. bold foxes 
65494,5495,7367,902.47,e carefully ironic accounts. carefully unusual accounts grow furiously among 
82722,7739,770349,833115.5347541763,are furiously. furiously pending frays wake slyly beneath the blithely bold hockey players. excuses are fluf
10105,106,1970,719.62, above the final excuses. regular asymptotes sleep across the furiously pending packages. blithely silent accounts are 
41314,8827,7704,985.13,"ss deposits. final, regular notornis cajole. blithely final deposits a"
60751,752,7983,515.16,", regular requests. regular instructions nag carefully. even instructions wa"
39668,9669,3129,156.56,"ccording to the carefully regular instructions. careful forges are above the excuses? quickly unusual excuses haggle carefully of the pending, regular "
144109,6624,4267,61.1,dltjwiwpod
134778,121971,11076,877.93,peqzyghzla
44673,9682,4783,961.95,fully even theodolites nod according to the blithely final asymptotes. blithely special forges use furiously quickly pending gifts. slyly final d
129493,4518,229762,342.61,nusual requests against the packages nag after the furiously unus
2857,7858,5910,644.82,e special platelets. slowly unusual pinto beans haggl
188018,5573,7374,762.06,"ess courts. express, special packages alongside of the blithely unusual packages nod blithely along the even accounts. carefully silent instructions nag"
22260,2261,5813,41202.0550444272,uriously final requests hinder of the ironic accounts. slyly silent pinto beans snooze. slyly regular requests wake quickly. fluffily regular instructions cajole f
164996,333442,7614,973.19,thely above the bold excuses. carefully special ideas haggle about the quickly special
142606,412752,6404,971.02,uickly ironic deposits alongside of the blithely special pinto beans cajole excuses. fluffily unusual deposits against the deposits wake furiously special packages. furiously 
182690,2691,5686,350.98,ar foxes cajole along the pending deposits. blithely regular hockey players according to the slyly pending accounts cajole fluffily accounts. slyly close ideas use on th
29074,513262,4939,515.04,"ts use furiously final decoys. final, regular deposits wake requests. even accounts hang alongside of the unusu"
31848,6855,345458,333.03,"l theodolites detect. blithely final accounts detect blithely furiously ironic ideas. carefully regular platelets cajole quickly against the careful, regular p"
189809,2328,5876,341.86,tions use slyly special asymptotes. carefully sly instructions are qui
121854,4367,484841,182124.37217395328,s haggle slyly regular pinto beans-- slyly bold requests inside the furiously bold foxes are across the excuses. fluffily final somas cajole against the car
70177,215806,830780,469.9,aggle stealthily quickly express packages. permanently bold requests nag; ironic foxes are blithely silently special requests. regular asymptotes haggle. final t
102749,280,8574,226.19," even requests across the furiously regular requests was blithely blithely ironic dependencies. final, bold requests run fluffily. furiously special foxes"
147314,7315,751714,307575.78373161075,pygocgzont
188734,178327,304106,789532.4666064357,"fully stealthy deposits cajole. pending packages alongside of the bold, silent packages run about the carefully regular dependencies. speci"
197940,2979,6122,836.16,aters detect blithely fluffily even deposits. slyly regular deposits should cajole fluffily. blithely pending requests cajole carefully along the quickly regular foxes.
164571,744624,5199,482.39,"fter the quickly unusual instructions. even, pending foxes wake slyly unusual packages-- furiously unusual requests nag carefully pending requests. furiously ironic frays after the stealthily e"
44009,1522,3639,539.94,bold ideas haggle blithely slyly special foxes. unusual asymptotes wake carefully alongside of the ironic platelets: pinto beans are fluffily against the blithely 
29451,4456,2345,656326.4125583228,afhdmxzttm
147980,7981,3556,965.78,"fluffily above the foxes. dogged deposits wake furiously? accounts boost ironic, express waters. furiously ironic accounts among the furiously ironic orbits are according to the silent tithes."
10041,2543,3609,656.66,dolites doubt after the ironic accounts? slyly final platelets sleep slyly requests. packages about the regular deposits cajole quickly furiously unusual requests
107658,48931,4620,369.67,bold platelets boost according to the deposits. carefully bold theodolites sleep quickly
156901,1932,972,299.88, slyly close pinto beans. furiously final ideas boost furiously. carefully ironic requests alongside of the carefully final accounts use abov
161381,3898,2579,973.63,"ously unusual ideas. special accounts beyond the carefully final deposits are ironically above the slyly unusual instructions. ironic, ironic accounts slee"
116193,1216,841319,39329.293233510754,yjoyisfypa
123667,844717,1247,208.87,czbegosmtp
130172,5199,7208,752.66,mptotes sleep furiously. final foxes haggle carefully express packages. carefully ironic foxes cajole s
55571,3087,5770,924.47,ar packages. blithely ironic requests integrate quickly according to the slyly ironic accounts. ironic ideas nod blithely: pinto beans about the furiously ironic pinto beans ha
91723,4233,3501,533.73,mqwlyvridq
67483,9990,2869,844.08,tions. regular theodolites affix slyly furiously 
180853,3372,199,277.87,ic deposits around the slyly pending packages use carefully regularly blithe ideas. fluffily ironic deposits nag carefully fluffily silent requests. slyly final requ
35938,798223,702180,941958.0782610974,he quickly even packages. fluffily regular courts could cajo
29262,960579,3457,256.47,"e. packages cajole carefully above the furiously final pinto beans. final, final dependencies sleep carefully alongside of the"
90301,2811,9829,250.62,"cording to the furiously silent attainments. stealthily ironic instructions boost according to the quickly sly requests. stealthy, ironic asymptotes haggle furiously unusu"
43542,3543,619329,177459.36425345577,gxxojwfcry
149290,1805,5336,285.9, blithely ironic packages. blithe requests against the slyly ruthless deposits haggle among the carefully final pinto beans-- carefully ironic co
99640,4659,9066,519.63,even requests boost. unusual accounts sleep boldly. slyly ironic accounts wake furiously requests. quiet request
99209,9210,5961,944.08,icingly. slyly final dugouts use thinly along the slyly regular excuses. slyly express foxes sleep furiously among the quietly ironic account
194611,4612,6795,796.65,old orbits. furiously unusual pinto beans nag above the slyly final packages. furiously pending orbits wake furiously carefully regular packages. asymptote
61588,4095,6075,428.23,zrbxlxombe
117809,7810,223,929.15,nstructions haggle furiously final deposits. blithely furious foxes must cajole across the slyly regul
95716,603660,9787,140998.83196872807, accounts. ironic theodolites are. packages after the quietly final ideas cajole blithely after the ironic instructions. foxes integrate after the ironic plate
23813,8818,3087,69.81,usly ironic foxes breach fluffily special asymptotes. carefully eve
72551,593070,736730,726277.4917031538,ouepvxkkin
108100,611,809069,672216.1618415811,"ly even packages cajole blithely final pearls. furiously express deposits wake carefully regular accounts. even, regular asymptotes cajole slyly accounts. carefully special accounts boost "
126428,6429,2975,644.4,before the accounts. ironic deposits sleep carefully across the
146732,4275,793715,306167.28932781855,wuvaxmioog
178194,8195,2779,277.38,"lently. express, final ideas boost blithely. even accounts wake about the unusual, ironic excuses. slyly even instructions haggl"
31515,9025,578553,118879.3151552845,"ely idle ideas play. permanently bold packages about the final, final accounts thrash slyly before the final grouches. dolphins around the carefully even theodolites cajole about th"
6419,310149,6611,275.52,sits haggle slyly except the carefully bold pinto beans. regular requests use furiously packages. 
186732,1769,7475,183023.11306033182,secxgvhwna
57590,5106,5585,580.63,ly: blithely bold foxes haggle blithely. special theodolites af
148779,3808,7213,110.34,"s run carefully even, pending foxes. bold asymptotes sleep among the carefully ironic deposits. accounts nag blithely among the slyly regular requests. quickly bold ideas nag careful"
73499,3500,902481,793.5,moxbaemoqi
176242,221196,901963,986042.849976847,laoxmlphrr
191999,2000,851092,194766.67323051166,bmfuxcnejl
142565,7594,852,934.13,es. bold accounts haggle furiously? carefully regular frays nag blithely furiously re
44183,196502,7765,745133.4298392936,osits nag among the fluffily express requests. quickly enticing accounts 
132118,9658,7738,158.53,ykbgsxmttn
167353,869625,4078,322429.51047246484,kimbnujcea
24301,1808,5451,169.3,ckages use blithely about the slyly ironic accounts. quickly dogged platelets cajole. even pinto beans lose furiously even somas. furiously e
94177,4178,7649,722.2,intain. fluffily bold deposits eat against the carefully regular pinto beans. carefully special accounts detect carefully ironic accounts. furiously silent packages nag slyly final
9379,360130,956425,928.18,gzpnpiqmul
38114,8115,604,984.76," slyly final packages. blithe requests affix quickly carefully unusual ideas. blithely ironic ideas about the even, final deposits sleep blithely against the quickly final theodoli"
83462,987,6312,900.66,"behind the pending pinto beans. sauternes haggle blithely silent accounts. pinto beans wake blithely final, ironic packages"
49168,9169,820397,379677.6095414042,the even sentiments. carefully stealthy accounts haggle furiously express foxes? carefully regular instructions before the dolphins serve blithely above the furiously unusual theo
94806,2334,2011,666.64,"hogs. ironic, regular requests are carefully express, final dinos. blithely bold requests haggle bli"
90989,6008,399856,450548.93715199607,s haggle fluffily. slyly express packages along the ca
125235,277452,6653,436085.34549270396,"e of the bold, special deposits are carefully instead of the pending, unusual instructions? final, final Tiresias are furiously. fluffily bold deposits sleep. carefully pending accounts wake "
180724,947032,5263,910219.2558754265,evvqjrowxb
30142,2646,7114,535.2, orbits among the blithely express requests use furiously requests. packages after the slyly final excuses cajole blithely regular requests. carefully silent deposits about the b
175107,142,5815,90.9,"h quickly alongside of the theodolites. packages use above the instructions! ruthlessly even accounts sleep after the quickly even instructions. final, pending accounts affix quickly-- doggedly spec"
13907,3908,86282,492772.31357402675,quickly express pinto beans print blithely about the fluffily busy accounts. slyly silent deposits sleep blithely deposits. special frets use always 
37174,4684,713731,484.15,jzdnsdfzqw
127235,4772,2400,79062.26862728894, dolphins cajole against the carefully express dependencies. express accounts sl
10032,2534,8894,235.89,"ut the pending dugouts cajole blithely about the slyly bold ideas. quickly special waters despite the unusual, final instructions are carefully fluffily ironic requests-- ca"
196707,9227,9122,624.96,he express packages cajole above the ironic foxes. idea
188607,3644,4194,524.45,fully special ideas boost carefully around the furio
37462,838830,7376,401838.98135868856,among the carefully regular foxes boost blithely slyly pending
1237,8738,3773,252.17,"foxes. furiously unusual accounts haggle. final, final requests use quickly across the furiously express dependencies! furiously regula"
190980,3500,1949,877.02,"ar escapades cajole deposits. theodolites are special instructions. ideas cajole special, unusual accounts. deposits cajole instr"
55242,980097,467783,424.49,vdiamlxcxm
28547,6054,1686,146.56,"ve the carefully bold sheaves. furiously quick theodolites sleep fluffily across the carefully regular requests. final, ironic pinto beans above the regular pinto beans"
171571,1572,8802,588.63,y carefully express courts. quiet theodolites around the blithely final excuses sleep slyly among the carefully regular dependencies. instructions haggle slyly. careful deposits haggle 
197085,9605,8824,248609.38431126522,"f the permanently regular instructions wake carefully express dependencies. carefully final accounts according to the unusual, unusual pinto beans sleep furiou"
32009,927951,7013,644.71,"r the pending pinto beans. regular, final foxes against the regular requests haggle permanently about the ironic, ironic theodolites. slyly bold excuses cajole slyly slyly unusual fox"
103148,5659,7088,448045.6843852876,"slyly final attainments. ironic, slow packages haggle packages. quickly ironic pinto beans detect c"
18656,3659,967,627.6,"sts haggle carefully final pinto beans. regular, express notornis hang blithely against the carefully slow dependencies. blithely bold instructio"
66293,3812,2034,973.79," slyly special excuses. slyly pending deposits affix furiously quickly even theodolites. final, regular pinto beans will have to detect"
9314,736735,371381,406132.80646165815,"uickly. quickly special pinto beans do nag slyly final, regular requests. regular theodolites haggle quickly. quickly regular packages wake carefully carefully final waters? slyly unusual pains wake"
5379,380,340822,345969.5591840062,yioxsmnofg
52221,425860,4002,401.51,ions about the carefully final deposits ought to snooze across the permanent theodoli
7461,4962,9904,608.1,"ts at the quietly regular accounts sleep above the pending, regular instructions. final accounts sleep carefully. quickly bold ideas wake quickly al"
86621,6622,2558,894.68,"dinos sleep carefully final, special foxes. blithely ironic deposits alongside of the ideas sleep fluffily along the carefully special platelets. "
58765,375478,2614,285542.4367172653,"lly according to the express deposits. ironic, final ideas cajole alongside of the pending, ironic foxes. carefully final requests nag blithely along the silent theodolites. furious"
23992,962271,8362,23.91,mmiphvmdll
47389,9894,4701,817.12,"uests wake carefully across the bold instructions. blithely unusual accounts use furiously after the express requests. blithely express accounts among the bold, express "
52167,9683,671393,691617.085042745,yytiatvkib
167373,2406,2259,792.0,"ross the daringly silent packages. furiously regular ideas boost furiously along the regular, ironic pinto beans-- furiously s"
150468,954179,8513,673.87,"thy deposits. slyly slow deposits mold sometimes quickly careful sentiments. regular, pending platelets nag idly final excuses. special, regular pinto beans detect qu"
81205,3714,6872,639.6,ly even theodolites sleep furiously. blithely dogged deposits inte
133275,8302,8347,120.1,along the quickly unusual deposits. ironic deposits according to the quickly even packages cajole blithely
45088,5089,4993,955.99,"kly even, bold requests. slyly even accounts boost slyly. deposits wake furiously quickly regular theodolites. sile"
189929,7484,919873,790585.0930251449, slyly regular accounts haggle. carefully pending accounts nag carefully above the carefully quiet patterns. blithely ironic packages of the final accounts affix slyly fluffily ironic depen
12776,398707,4054,224.15, excuses use blithely ruthlessly regular deposits. carefully regular ideas among the quickly regular instructions might boost ironically around the slyly final accounts-
103593,1124,2831,278.42,ross the unusual realms. slyly ironic theodolites nod carefully. furiously close instructions among the slyly special ac
162643,2644,4936,673.71,gainst the carefully regular instructions. quickly final theodolites cajole furiously furiously ironic deposits. deposits around the quickly 
97688,5216,4782,464.61,heodolites sleep along the blithely final accounts. carefully even accounts nag furiously. furiously bold foxes eat furiously fluffily bold platelets. final deposits must
46894,6895,19,599.38,"lites about the regular instructions poach across the blithely fluffy excuses. express theodolites according to the special, even accounts wake "
113215,749,2603,415355.58450853906,arly express accounts. even deposits cajole slyly instructions; slyly even foxes thrash blithely alongside of the furiously bold instructions. slyly regul
60295,5308,5080,86.72,"te fluffily. accounts cajole! carefully regular instructions against the asymptotes poach fluffy, unusual theodolites. regular, ironic asymptotes affix special, ironic epita"
98669,531020,3201,153.09,"usly regular notornis. accounts cajole slyly. quickly furious requests must have to sleep. accounts about the furiously express requests are above the blithely ironic packages. regular, "
90234,931457,2665,592216.9457159769,zyyjxnbmol
84265,4266,2079,225.43,"he pending foxes are fluffily about the pending, special requests. special foxes are carefully idle asymptotes. quickly final requests snooze special instructions. ideas wake after the furiously iro"
105653,633356,885121,415798.0195061083,ets according to the carefully express courts would are dur
31839,4343,1395,353.12,enticingly on the blithely express requests. final dependencies wake after
63680,3681,4716,89.57,lly silent requests x-ray slyly above the furiously express requests. carefully ironic packages wake bravely. regular instructions cajole carefully. carefully regular pinto beans cajole furio
135765,3305,212466,373191.27164283994,. fluffily ironic theodolites haggle quickly slyly regular Tiresias. quickly ironic accounts across the furiously even attainmen
159229,9230,2324,74.21,eposits wake carefully along the blithely final accounts. silent theodolites ar
67201,2214,6557,978.94, bold dolphins haggle quickly blithely unusual accounts-- bold foxes are carefully about the furiously regular gifts. care
160805,5838,234599,977443.8668430904,txpssywczm
107200,9711,9755,873.32," foxes haggle behind the regular, ironic deposits. carefully pending instructions haggle about the epitaphs. quickly regular dependencies across the regular packa"
83594,1119,7226,505.79,ely among the packages. slyly final deposits against the idly ironic deposits cajole quickly about the furiously bold accounts. fluffily pending pinto beans after the
145893,922,169,859.92, the furiously express excuses. furiously pending in
183164,719,4146,32.47,"ut the furiously even instructions. regular requests integrate furiously. frays cajole. fluffily regular requests among the special, pending deposits sleep according to the quickly ironic deposits. "
92296,7315,4178,166.05,counts use across the slyly express asymptotes. furiously ironic foxes cajole furiously depths. 
133375,5889,4461,924.03,eas according to the quickly express requests doubt carefully along the slyly regular deposits. quickly unusual deposits are. carefully express asymptot
190886,887,1698,104.32,"iously bold, even deposits. slyly bold deposits believe carefully pend"
7951,7952,5804,200.96,quickly regular sheaves. slow deposits sleep quickly above the blithely fluffy foxes! blith
15819,163237,309345,774265.4457957605,pacviggllz
80320,206490,9531,685938.6853985019,mswznwumyw
106377,413143,9586,488.46,dxgmwwgwry
117345,867265,9112,541.08,. regular instructions integrate quickly blithely pending requests. furiously unusual ideas cajole fluffily among the regular theodo
11672,1673,4976,359.83,"ffily regular deposits. fluffily pending courts wake furiously across the silent, pending dependencies. blithely regu"
32359,432388,6493,209971.98307435794,"fluffily bold foxes thrash slyly even, final deposits. asymptotes cajole carefully even pinto b"
129073,1586,2367,778103.6536411989,". quickly brave pinto beans nod blithely unusual, regular requests. blithely final packages integrate fluffily silent instructions. blithely final dolphi"
135823,5824,355348,872556.4523444641,szzxqkorzg
