partkey,suppkey,availqty,supplycost,ps_comment
140948,633940,1706,249.17,al requests-- accounts hang. asymptotes sleep blithely. even excuses sleep above the final pinto beans. regular dugouts boost slyly. blithel
121897,547983,96670,464.94,theodolites snooze slyly ruthlessly pending packages. platelets cajole. slyly even deposits haggle ir
13926,208582,4353,155447.40913780176,s. blithely busy theodolites detect carefully final instructions. final ideas detect slyly among the
69613,7132,5967,18.8,"y pending accounts wake furiously; blithely final platelets haggle blithely final foxes. ironic, special accounts affix carefully. slyly even theodolites are among the even packages. bli"
94193,507640,603203,83.92,tfhkopodgm
25554,3061,8490,113.12,ccounts. blithely idle excuses about the slyly re
13533,3534,9665,281.2,. bold packages wake blithely according to the furiously pending ideas. blithely express theodolites are. packages cajole. quickly ironic requests are above the slyly final packages. entic
25685,8188,6012,266477.8958717863,"r asymptotes cajole boldly. ironic, regular instructions integrate carefully. furiously unusual Tiresias aro"
167447,7448,4766,637.61,e blithely ironic requests. fluffily bold packages about the even packages wake blithely among the final accounts
136460,939638,790256,213702.72239588594,qmfyuhoicv
136742,4282,5356,128794.88392107164,sbjnrovzkg
104435,6946,347846,756160.299291226,inal requests are about the furiously even accounts? never busy somas unwind carefully against the blithely regular platelets. orbits solve slyly slyly fi
79340,1848,6086,225.03,ng theodolites above the final pinto beans cajole never ironic
177538,56,3073,330.07, beans. quiet instructions are. carefully special foxes wake slyly. blithely specia
106221,6222,4228,124.92,"thes. close, quiet pearls are alongside of the dolphins. slyly final accounts sleep in place of the pending theodolite"
148847,29481,6537,751570.7634694147,uslojexacc
125274,119525,653196,666.26,krvtgulamp
146355,3898,4474,258.81, regular accounts nag blithely. special requests p
147980,5523,8035,25.29,piegzsfquz
116664,1687,2548,452283.2504333811,ktlprdfppx
145022,51,955966,756.93,rmjclujeqm
38927,174862,859471,780519.382429763,ehxfukrass
151902,9448,3276,566.43,pecial courts integrate furiously across the even instructions. blithely regular requests against the fluffily bol
76644,1659,5386,670.34,ructions. courts sleep slyly unusual orbits. slyly bold accounts wake furiously.
85847,8356,8132,818.22,ts nag blithely. bold packages sleep. quickly pending requests are. furiously final platelets x-ray furiously? bli
151883,6914,9092,860.29,"s wake slyly alongside of the express, regular platelets. furiously even theodolites haggle un"
176184,1219,4350,981.84," regular packages. fluffily regular packages among the carefully unusual theodolites cajole final, silent accounts. final, unusual requests cajole quickly. ruthless p"
132087,61852,7784,528.96,qtpvsugutc
199906,353536,4696,106.84,ct between the evenly special forges? quickly final accounts engage furiously carefully bold requests. regular packages eat carefully. unusual asymptot
46461,1470,1850,312.48,rate blithely express requests. fluffily regular accounts cajole slyly regular accounts. final platelets are besides the un
122625,162,8716,789.75,kages grow carefully quickly even instructions. blithely daring requests wake slyly stealthily regular deposits. slyly special multipliers cajole carefully. slyly even packages boost above
86154,6155,4856,682498.2477024925,wfhsruowjl
154456,9487,444,660.79,deposits sleep after the even requests. asymptotes across the furiously regular excuses boost slyly among the carefully final accounts.
159580,9581,9113,737.92,"detect blithely according to the carefully express packages. asymptotes wake slyly bold, final platelets. furiously final pinto beans are slyl"
27786,5293,5208,69.63,the packages. furiously quiet pinto beans could detect slyly. ironic grouches serve carefully alongside of the slyly idle instructions. regular accounts sleep among t
96685,1704,433,663.34,"bold requests integrate across the furiously regular requests. unusual requests about the idle, unusual theodolites unwind silent requests. slyly sp"
16680,4184,7171,754.23," of the furiously regular pinto beans detect courts. regular sheaves against the blithely even requests snooze blithely bold instructions. final, ironic ideas doze--"
154346,9377,660335,733739.1538819566,bgptauqxmn
171493,6528,6556,809.41,"ckly silent braids sleep furiously ironic, final packages. final, regular deposits haggle. unusual,"
80572,3081,9786,160.84,xpress ideas haggle furiously alongside of the bold foxes. slyly silent instructions above the blithely regular requests sleep furiously across the bold accounts. special 
174745,9780,335888,649401.8709876818,wusqbjzoio
113315,762984,374384,306530.9406852459,abbzopczfc
29155,527243,280683,464.23,s packages. final ideas cajole around the special deposits. ironic foxes may use. unusual packages wake fluffily final requests. carefully regular instructions
8126,942178,401314,548.5,nal deposits. final requests unwind furiously among the slyly silent packages. furiously final packages across the quickly express accounts could
2136,9637,8833,241.24,atelets haggle blithely. dugouts integrate unusual requests. blithely regular requests wake carefully after the fluffily ironic ideas
28485,3490,2180,395.26,acgurljbax
88126,3143,736469,884162.940670998,wind furiously across the quickly ironic instructions. fluffily regul
113132,3133,1310,190.26,furiously even dolphins boost instructions? slyly special accounts nag closely. final notornis after the carefully re
160821,8370,4980,551.21, instructions along the quickly unusual deposits wake about the packages. ironic packages b
11787,437766,754955,3.58,qmdkbazoth
97554,2573,1240,533.5,"y even instructions. deposits of the quietly express theodolites boost fluffily across the express, regular deposits. dogged deposits a"
84242,4243,408455,103.24,"inal requests above the slyly special deposits wake even deposits. even, daring requests haggle slyly after the fluffily close deposits. slyly ironic requests hagg"
157086,9602,529066,817.85,gpezarzsvs
19456,9457,4433,859.74,quests. carefully even pinto beans wake furiously even ideas. ironic deposits doubt ironic ideas. 
53004,288404,396,100.66,"quests. regularly bold theodolites haggle slyly blithely special excuses. dogged requests cajole blithely. furiously ironic packages cajole. final, slow instructions integrate carefully"
183095,386918,99973,345057.18717305036,hely ruthless foxes wake always silently close asymptotes. slyly ironic ideas cajole permanently against the dolphins. fluffily final requests nag about the slyly regular deposits. carefully cl
177043,7044,6966,73.39,"l accounts haggle furiously at the pinto beans. silent, special deposits alongside of the idly ironic deposits boost furiously above the fluffily final foxes. final requests sl"
60232,5245,3957,155.93, haggle. unusual ideas do detect blithely final excuses. slyly 
164718,9751,5953,497.63,ely regular accounts. carefully special packages cajo
156426,1457,9616,390.52,uaylgmcubv
47966,304333,879189,946.52,hlfkywbgtu
172024,7059,5035,218.4,vrsfdojzfc
41198,3703,5906,811.09,ests boost after the quickly pending requests. regularly regular requests dazzle. furiously regular grouches detect according to the unusual deposits. furiously fina
101090,6111,1477,390135.93220484845,fntswaaqhp
71902,4410,4906,754.5,"nding accounts. fluffily ironic requests sleep quietly pending, express asymptotes. unusual asymptotes grow blithely ironic, unusual theodolites. quickly regular"
150910,3426,253486,783845.8457639596,arksxitbqy
130566,473649,616895,862.56, express requests. quickly even pinto beans wake among the blithely special accounts. s
121442,1443,738,950.56,"lyly regular pinto beans wake carefully about the pending deposits. blithely express packages wake blithely: slyly ruthless deposits except the bold, final packages"
116678,1701,7167,543.89,"ccording to the final pinto beans-- blithely special pinto beans are slyly above the special, even accounts. pending, final packages thrash. blithe"
129982,7519,2464,831.73,ions use blithely regular dolphins. carefully regular packages detect quickly special accounts. even deposits sleep carefully regular ideas. unusual accounts sleep slyly above 
173659,1211,932,200.66,press requests haggle after the special ideas. carefully ironic ideas haggle. unusual excuses against the fluffily regular packa
8697,1198,953,792.45,"lar deposits boost about the furiously even pinto beans! deposits against the blithely regular deposits affix closely across the regular, regular requests. quickly iro"
75436,2958,4534,462.98," slyly. carefully final platelets cajole slyly after the final realms. silent deposits nag express, careful dolphins. careful packages was. foxes play blithely above the brave excus"
90090,5109,2878,322.89,onic excuses haggle along the carefully regular ideas. slyly ironic instructio
6402,749999,542937,991.27,istyeuxqwv
15378,565847,2958,786.35,bhscsmtldk
89713,7238,8365,575.97,ole furiously even packages. fluffily special instructions wake furiously blithely unusual deposits. final ideas will nag fluffily final sheaves. requests haggle among the slyly special depo
115974,3508,5794,284.48,"etly final requests. even, bold packages integrate. furiously even deposits affix sometimes. final, final decoys cajole slyly along the carefully unusual instructions. theodolites use "
18941,1443,726310,86.43,bgaeibuwrx
142460,3,6180,275.4,ress theodolites maintain. blithely bold platelets sleep
79463,653473,3086,941.25,szxckmtgbc
105305,326,4399,393.66,"ckly ironic packages nag furiously quickly stealthy instructions. packages use furiously thin platelets. furiously special packages sleep slyly-- quick, special requests boost slyly"
78050,8051,2894,5.82,ts. slyly sly excuses wake blithely even theodolites. furiously ironic theodolites sleep.
120765,8302,1769,808.87, ironic platelets wake. special deposits sleep carefully: slyly ironic foxes are blithely
6131,1132,5846,494.43, furiously bold dolphins. blithely ironic foxes doze quickly against the quickly 
1705,198068,42938,663013.278089759,ccucrwngag
78618,6140,7945,950.69,"equests. ironic accounts nag carefully. unusual, express dependencies after the theodolites are slyly acco"
123128,5641,644263,980.0,rzbpohqcju
49692,281461,442193,585546.5968252412,ecial asymptotes nag blithely along the regular ideas. quickly daring requests are fluffily. blithely pending asymptot
133292,3293,615344,976.01,"ing, express dependencies sleep blithely. regular excuses under the furiously ironic hockey players haggle sly"
131365,1366,83701,331472.7479739045,wrmfhszorb
82078,317443,182973,643.51,qhwibdipgc
24717,13872,446614,971.88,"fully even deposits among the blithely final packages integrate furiously unusual theodolites. ironic accounts cajole blithely. quickly regular requests cajole slyly. pending, express dep"
14850,2354,9116,759.91,arefully final accounts integrate furiously. slyly final foxes dazzle silent
114076,6588,5934,457.93,gnswozmpyg
34652,2162,9346,349.44,kly dogged deposits. silent pearls according to the regular packages print after the fluffily even accounts. furiously regular
188059,3096,3236,166.73,es haggle carefully unusual accounts. quickly silent accounts among the final platelets breach carefully regular instructions. quickly pe
189231,4268,489356,620.07, instructions maintain furiously regular packages. instructions boost blithely final pinto beans. foxes cajole furiously dog
50195,196,4177,841.7,"efully even ideas haggle. slyly even deposits boost ironic requests. carefully unusual somas sleep. unusual, express platelets sleep requests; regular dependen"
73297,5805,2716,446857.2956661169,elarymchpv
109739,2250,3870,78.99,"ic, bold instructions are quickly express packages. carefully even theodolites "
91141,1142,4859,624.13,es about the pinto beans hinder furiously furiously regular
150747,380376,218379,99.39,nwwmxxipba
97916,5444,669627,143.66,"ts about the regular, bold requests nag fluffily inside the fluffily final deposits; even requests cajole quickly against the enticingly special pinto beans. fur"
73264,150888,5561,293895.746992678, to the blithely final dependencies. carefully sly instructions wake slyly ironic inst
96284,8794,2021,608.75,o the bold requests boost slyly slyly ironic ideas. furiously regular dinos integrate blithely. slyly ironic deposits haggle fluffily. slyly ironic d
9704,2205,4473,466.57,xcuses cajole. furiously ruthless requests boost. furiously pending dep
81020,1021,338550,756404.4628933847,". quickly pending deposits along the unusual packages nag furiously quick, regular accounts. quick requests boos"
28044,3049,721203,699352.1904164613,khzbvbhisc
85726,592994,3665,882.26,skrtwnqrpq
41644,9157,8844,487.68,essly according to the furiously express foxes. regular theodolites above the furiously final foxes print dolphins; special instructions are above the fluffily pending requests. slyly ev
70136,396121,93661,617.89,y unusual theodolites cajole furiously around the bold epitaphs. slyly even packages sleep furiously blithely even accounts. fluffily special accounts accordi
63992,6499,1418,128.58,"ular ideas integrate quickly special theodolites. requests are. furiously pending pinto beans use. slyly silent requests are slyly regular, bold excuses. i"
181901,4420,8922,344.8,foxes; slyly bold frays wake blithely ironic requests. furiously final asymptotes wa
120295,622087,6702,675.0,xdgdlbrhxd
165195,5196,896301,201.31,aoohxnknyq
124006,9031,304157,297825.5969294926,"ly bold instructions sleep furiously. regular, final requests are slyly along the quickly unusual Tiresias. carefully stealthy deposits are after the reg"
167177,9694,8520,342.1,somas haggle according to the ideas; requests across the quickly special packages sleep carefully blithely ironic foxes. blithely regular accounts promise regularly. pending 
63175,5682,7400,616.95,ironic instructions kindle furiously carefully even requests. carefully ironic frays dazzle ca
57865,371,5206,765.81,ytnofeesrm
60334,2841,5245,467.78,"ial, regular ideas affix blithely. ideas nag above the furiously bold packages. furiously pending dolphins nag carefully slyly ironic requests. unusual packages ca"
63346,8359,1525,780.93,"accounts use according to the ruthlessly pending asymptotes. packages wake. pending, final deposits wake slyly fluffily final pearls-- silent, c"
38196,5706,2181,414.5,"regular foxes haggle against the unusual frays. ironic, unusual accounts about the furiously unusual packages are flu"
111000,8534,685,10.31, wake slyly against the carefully ironic instructions. blithely ironic deposits cajole along the regular deposits; furiously b
57636,5152,967201,107051.09005599856,yfsilvsvwn
133170,5684,5811,44.64,r the instructions. unusual ideas grow slyly after the ironic theodolites. pending courts cajole carefully regular br
79598,4613,1534,338518.7541628657,ynocexggfb
157905,7906,7457,410.96,"against the ironic ideas. slyly pending pinto beans wake slyly along the special, final warthogs. final account"
143007,8036,6309,551.12,"y after the ironic, pending packages. furiously silent accounts sleep fluffily regular packages. platelets about the enticingly express fox"
120896,897,4277,288.22,"fluffily according to the blithely bold pains. pinto beans use slyly. regular, b"
142519,5034,261276,19457.198919421102,agkbnmafys
77562,7563,5179,283.0,"according to the carefully regular requests. ironic accounts alongside of the ruthlessly final instructions boost slyly alongside of the slyly unusual deposits. unusual, regular requests wake alon"
143181,5696,4223,522.2,"ructions across the furiously regular patterns are carefully regular, final deposits. qu"
82585,7602,7897,645.83,kages cajole pending realms. unusual accounts are evenly carefully final i
84135,102025,2499,473220.0121717449,mhzqezmqwl
110759,760,2152,948.86,"nst the bold, express accounts. slyly express deposits dazzle. even deposits boost blithely. quickly regular"
80109,2618,4495,988.45,dolites are quickly ironic deposits. blithely ironic deposits wake across the slyly regular grouches. carefull
56984,482358,258876,365174.1716885537,qblgsequri
157600,5146,5496,696.63,"d packages according to the slyly final instructions wake slyly special deposits. carefully express packages sleep carefully about the slyly even somas. bold, final platelets are around the regular"
98199,687852,465214,811.55,rding to the slyly regular packages engage about the 
150563,635020,5191,235.96,uests. furiously express pinto beans wake fluffily ruthless theodolites. quickly ironic theodolites boost quickly furiously even packages. final deposits
64328,6835,1712,375.25,its solve slyly after the blithely ironic foxes. carefully regular deposits detect theodolites. blithely regular requests sleep idly alongside of the slyly unusual deposi
175455,606780,851553,287.51,xzzrlqfsrn
90421,2931,1874,546.46,deposits-- slyly express theodolites haggle quickly into the ironic courts. always silent deposits hang carefully slyly regular accounts. blithely ironic deposits de
4781,4782,7277,85.01,"usly above the pending theodolites. slyly unusual requests about the regular accounts grow along the final, final platelets. d"
79699,4714,5173,531.19,uests x-ray among the carefully regular deposits. blithely final requests haggle. regular p
26356,273370,621,158141.53390266438,y regular excuses! carefully pending accounts are according to the furiously unusual accounts. carefull
56190,6191,5958,398.24,"thely pending, regular requests. express pinto beans according to the ironic pinto beans haggle carefully final ideas. regular pac"
135198,952534,103956,25478.60842790328,s are among the fluffily regular dolphins. carefully silent dolphins affix. fluffily regular instructions poach carefully across the quickly even accoun
39929,805943,419404,424.47,qdddcprhxt
87035,7036,851275,387675.26298553037,pumomuihaa
154539,2085,2882,380.75,ly unusual accounts along the furiously ironic pinto beans haggle by the requests.
28461,5968,1598,47.2,egular pinto beans haggle. tithes sleep carefully. furiously express multipliers run. slyly ironic patterns at the slyly regular packag
18167,8168,792918,637322.2926456687,es. quickly ironic deposits nag blithely along the furiously fin
153926,361725,9725,452613.3891814001,yndwknpjqb
146901,4444,548232,444683.27430216206,"fully against the even requests. pending, final packages sleep around the quickly even asymptotes. slyly special theodolites engage after the slyly unusual packages. fin"
144077,1620,6700,932317.1774337897, blithely final theodolites boost carefully platelets. fluffily pending packages
4991,7492,6133,221.24,bsdlnmhtvl
179247,598862,441,470.44,ynumzocunw
26002,6003,3546,417.94,theodolites wake around the deposits. slyly express dugouts unwind across the fluffily unusual excuses. carefully regular account
175318,353,4810,625.03,". slyly final requests wake. final courts sleep furiously. furiously pending dependencies along the furiously silent ideas nag against the foxes. quickly regular realms nag. unusual, final a"
159390,9391,3162,901.24,"s cajole slyly courts. final accounts could have to wake. requests wake sly, ironic pinto beans. bold accounts along the final requests would cajole slyly carefully br"
42414,7423,8817,178.01,equests. regular multipliers integrate carefully.
43518,8527,977378,890320.5982062665,about the ironic foxes cajole across the slyly final packages. doggedl
4922,65692,9508,1508.271615274559,zarroytiol
128386,438485,5230,552.5,lucalhpojm
4704,9705,343474,243353.07030842546,hmbkwzcfky
199657,9658,4563,205.71,nts. blithely special requests across the sometimes special 
184133,544032,264712,871724.5698972439,"eodolites. regular, final braids cajole at the slyly ironic grouches. instruct"
117855,754459,7324,869670.6971488392,"d the slyly bold deposits? pending, ruthless escapades sleep furiously across the slyly special excuse"
918,5919,1789,765.91,"e. carefully express deposits cajole along the blithely unusual courts. accounts impress blithely about the regular theodolites. even, pending pinto beans impress. furiously unusual pinto beans afte"
14692,4693,3337,554.54,"ep furiously ironic accounts! ironically special deposits haggle busily quickly pending pinto beans. express, thin platelets nag. regular, ironic pac"
31274,1275,5938,387113.1723096173,the carefully unusual ideas. slyly even excuses wake; regular foxes sleep quickly above the ironic account
70390,2898,7270,638.01," wake across the ironic packages. ironic, even theodolites sleep blithely along the slyly even foxes-- theodolites cajole. final r"
98029,539,7771,267.32,endencies. slyly pending escapades sleep blithely above the bold accou
93771,3772,4797,98.34,ely above the carefully final foxes. carefully final accounts wake blithely. furiously even asymptotes kindle blithely foxes-- final theodolites are accounts! furiously ironic as
135827,854,60085,517.61,ding to the quickly regular packages. furiously express foxes use carefully stealthy accounts. fluffily ironic accounts use furiously. slyly unusua
26163,740058,3260,603203.2615849125,deogaokgbe
194454,6974,9556,911.29,usly regular requests solve carefully express requests. regul
146696,1725,2052,562.59,"alongside of the regular, regular packages? special deposits use slyly even, regular dependencie"
116424,624537,977577,678.39,frwpsnqbsk
107875,386,1058,421.29,ly. furiously ironic packages above the carefully ironic excuses boost blithely carefully iro
66969,4488,6286,178.63,"g the express dugouts wake unusual, even escapades. carefully ironic requests cajole ideas. blithely "
178897,8898,6705,456.55,ily bold excuses? regular pinto beans wake furiously. slyly even theodolites are furiously. sometimes pending packa
49021,6534,4016,740.92,uickly express deposits haggle. slyly even packages are along the pending dolphins. quickly ironic pinto bea
12048,7051,7274,262.38,sits are fluffily furiously unusual requests? furiously special packages could use for the blithely final foxes. regular ideas solve. quickly even packag
120640,759290,8068,680857.3378516749,rly close accounts use slyly furiously ironic requests. carefully ironic 
17727,848139,575776,305.21,tevrfsebhm
148146,5689,8118,554.42,blithely bold requests. ironically final platelets around the slyly final ins
69111,9112,2117,522.36,inal instructions after the furiously express accounts eat
52252,9768,5046,764.77,"ly regular pinto beans sleep fluffily pending, even accounts. fluffily regular pinto beans cajole quickly final ideas. even courts aff"
63261,3262,8127,776.45,"nag carefully accounts. final theodolites play blithely blithely regular foxes. express, express foxes detect even, iro"
22636,143,311,345.92,s always along the blithely express asymptotes? express braids use blithely silent pinto beans. foxes sublate alongside of the theodolites-- furiously pending instructions according to the sl
86831,9340,6140,453418.3403070817,ent instructions. carefully unusual requests shall have to breach fluffily. blithel
96984,2003,9692,978.47,ickly regular requests. quickly final accounts haggle. unusual dolphins haggle slyly. carefully express deposits nag above the deposits. slyly final foxes ha
145244,273,2990,686.37,requests cajole carefully final instructions. carefully close asymptotes nag carefully after the 
42026,9539,4829,284.97,ss deposits among the furious packages cajole furiously frets. blithely final pinto beans amo
51088,6099,5787,271.95,to beans. pending requests sleep blithely slyly express instructions. blithely pending dependencies against the fluffily special accounts must have to are furiously instead of the furi
56214,929456,618064,62557.640209404686,zuuvhvujfo
179830,826519,6576,25.66,odolites sleep. furiously unusual platelets affix. carefully express theodolites serve. unusual deposits across the deposits lose furiously quickly ev
34344,6848,1870,288.52,to beans are blithely along the pinto beans. sly instructions wake 
144794,9823,9713,897.67,y ironic accounts. furiously regular tithes affix carefully around the deposits. express depths about the unusual packages are evenly ironic deposi
135170,5171,1867,850.95,. quickly special theodolites sleep daringly express deposits. quickl
6259,977121,636220,798.56," packages. slyly regular grouches haggle furiously ironic accounts. special theodolites cajole. regular, regular package"
4021,1522,9311,323.66,ccounts wake about the pending packages. carefully final pinto beans are furiously. pinto beans wake. furiously even foxes alongside of the blit
131690,141465,826957,707.91,after the quickly final requests. final ideas integrate fluffily ironic theodolites; furiously pending fo
100375,208684,8664,942.1,mbybzeoyqe
175617,8135,7112,345285.765792637,ggxurvfpqs
104871,9892,3630,561.65,s the slyly final accounts mold fluffily above the regular 
33138,483230,1110,644810.494637574,"l ideas. regular, unusual pinto beans at the regular, final epit"
162722,7755,3130,291.95,y final platelets wake furiously among the daring packa
83581,692304,411188,76.18,r requests. unusual pinto beans sleep blithely unusual packages. packages haggle slyly furiously
104875,2406,5963,120.72,"ep furiously. slyly bold platelets wake despite the regular, regular requests. carefully unusual packages boost slyly. qu"
96489,384213,577185,184728.72195793534,s across the fluffily stealthy requests wake alongside of the slyly final packages. bold theodolites are sin
128736,3761,4919,609.17, regular foxes cajole; furiously ironic requests haggle fluffily after the instructions; furiously ironi
16866,1869,11315,77.56,uickly express requests. sometimes regular packages wake closely above the qu
