partkey,suppkey,availqty,supplycost,ps_comment
161608,4125,9306,696.65,"bold accounts sleep fluffily deposits. final, unusual de"
152701,313996,933953,298.35,iyeugvmepi
124328,973169,4982,889438.2030806838,vanmdlyktq
90286,530658,1377,933.36,stngcqqohy
168735,8736,7292,895.67,"ironic accounts outside the bold requests haggle quickly slyly bold requests. blithely special requests was furiously theodolites. final, "
51586,1587,439,711.3,"use under the unusual, regular foxes. even, ironic asymptotes hagg"
38334,5844,1950,417.15,"tealthy accounts. final, special pinto beans detect outside the quickly regular excuses. blithely express packages nod furiously after the blithely final ideas; fluf"
195027,5028,2955,87.16," regular ideas. theodolites nod. requests sublate. theodolites along the quickly final deposits haggle slyly past the express, even requests. requests according to the"
59797,9798,2727,535.16,ifvesokedl
127500,2525,1042,118.79,ess packages haggle carefully according to the final deposits; evenly special pinto beans against the final pack
87954,24734,6604,282928.07022791746, the carefully express requests. final ideas cajole. final platelets along the finally ironic platelets haggle blithely according to the even packa
138219,733,4685,860837.8180088638,fvuzpkpvag
31205,668107,986716,593.64,hahzqlhpbw
65771,1015,566719,378.69,jaevaeofqz
166545,4094,8278,172.4,aonspcszfh
99242,901544,4695,840802.0072089643," ironic dolphins lose slyly. blithely even pinto beans about the even, even tithes cajole carefully carefully final tithes. slyly special instructions along the sly"
199400,6958,9266,113.52,"s lose furiously even theodolites. instructions thrash sometimes above the furiously ironic pinto beans. furiously regular excuses detect slyly final, ironic sheaves: final deposits serve slyly abo"
149096,997241,354902,248.3,bagqjdrnli
11240,8744,2820,47.47,ular deposits wake furiously. furiously pending ideas affix blithely. regular pinto beans abo
127298,2323,398802,385412.8413028173,ic asymptotes: courts are blithely. blithely bold foxes at the pending packages s
94273,264052,823211,38.19,nding ideas cajole carefully at the dependencies. blithely bold orbits sleep. carefully even requests snooze furiously blithely special asymptotes. c
120498,8035,1184,40.77, of the slyly sly instructions. furiously unusual theodolites use quickly alongside of the slyly sly sauternes. carefully ironic theodolites sleep furiously accounts. fluffily final
101132,8663,366,520.02,"l patterns cajole carefully regular packages. bold, silent requests poach carefully. thinly regular packages wake carefully care"
188148,3185,1415,122.98,requests? blithely regular accounts across the slyly express requests sleep about the quickly final theodolite
130160,887979,4042,218094.2585888246,ackages detect after the carefully pending platel
30417,418,4025,192.88,tipliers. bold packages cajole quickly blithely ironic packages. deposits about the packages wake fluffily furiously pending accounts. blithely pending foxes use boldly fluffily sp
1322,1323,5319,481.85,"the special, quick packages unwind carefully express ideas. foxes breach carefully furiously unusual"
86793,482685,347381,698.27,lithely instructions. regular instructions try to grow stealthily around the quickly regular asymptotes. carefully even instructions sleep doggedly stealthily bold ac
12891,7894,7403,59.24,are. fluffily final pinto beans among the pending theodolites promise above the blithely final d
51260,6271,6718,293.71,y blithe packages. quickly regular accounts sleep furiously thinly express requests. furiously ironic platelets cajole blithely. ironic requests
104116,905572,5846,133354.10381165435,"packages above the quickly ironic deposits cajole packages. ironic, pending deposits "
134070,6584,2556,450.08,e. packages among the deposits sublate carefully regular courts. carefully regular instructions cajole ideas. fur
93735,681190,1365,649.62,kzephefhhn
19198,9199,873074,852781.2809896432,xawezlgbzo
70929,930,824,454.15,ajole quickly bold packages. bold pinto beans sleep carefully. furiously ironic requests are carefully b
76163,336334,262,46.26,asudmwucwf
94999,7509,3968,943.03,"refully despite the bold deposits! blithe requests after the blithely pending platelets detect blithely from the ironic, ironic asymptotes-- plate"
18326,768568,18807,272325.0976126437,onic foxes sleep slyly carefully regular ideas. even deposits shall have to cajo
123606,344718,4173,897241.4669659935,caotsxivih
76665,6666,6644,18.9,uickly regular requests. quickly even theodolites haggle across the carefully regular pinto beans. dolphins sleep. pending excuses 
20552,8059,7216,404.55,"otes cajole carefully along the unusual, final packages. fluffily regular excuses among the slyly regular th"
165796,5797,4737,832.98,"ickly regular packages. slyly regular multipliers haggle against the ironic, bold accounts. ironic packages haggle regular realms. carefully regular asymptotes sleep fluffily quickly ir"
86867,6868,544403,654.3, theodolites. slyly pending requests boost bold platelets. furious ac
138259,594150,1979,648193.5963727119,rvaxksqzuk
134004,9031,4549,91.37,ironic theodolites sleep at the furiously ironic accounts. blithely even theodolites should kindle regular accounts. bl
53532,260881,214114,375.02,press. furiously ironic deposits wake blithely fluffily final ideas. furiously express accounts affix carefully. even foxes against the slowly even requests detec
71539,1540,3433,646.05,ular packages will have to affix daringly asymptotes. slyly ironic instructions nag carefully special foxes. slyly idle requests haggle. regular frets against the doggedly special pinto bean
40418,7931,7577,337.34,jole about the quickly regular accounts. slyly ironic pinto beans boost furiously final requests. quickly ironic requests are slyly. blithely special Tiresias wake slyly furiousl
172457,9,5165,656.11,eep slyly requests. blithely ironic excuses are according to the carefully ironic pinto beans. furiously ironic ideas about the slyly daring instructions haggle furiously bold tithes. carefull
38127,631,9345,758.01,oss the carefully pending asymptotes. furiously express instructions affix carefully. packages are furiously. bold accou
74179,1701,2127,255.05,ideas above the grouches use across the fluffily even courts. furiously unusual deposits cajole quickly express courts. slyly express dependencies wake blithe
19855,2357,34609,233916.59982194134, haggle final requests. slyly fluffy instructions wake furiously even ideas. final foxes sleep slyl
28927,514756,534650,760332.8219686504,clyvsokjkq
95472,541278,212031,189332.1014666852,osblxrdxcp
145100,129,8688,133.55,y courts integrate slyly furiously ironic braids. quickly final accounts kindle blithely. gifts haggle. carefully regular accounts are. furiously pending ins
140382,383,9775,26.51,s serve furiously across the dependencies. slyly regular
114836,9859,5561,915.36,eve doggedly ironic ideas. final accounts kindle. fluffily express platelets are furiously slyly regular asymptotes-- depos
135110,2650,6563,593.9,"le furiously final, ironic theodolites. bold pains cajole furiously ironic instructions. deposits cajole furiously final instructions. even dependencies wake blithely at the special ideas. "
136196,6197,5674,471.0,ing instructions. carefully regular accounts above the blithely ironic instructions cajole against the fluffily express grouches. 
173682,3683,1596,989.5,ccording to the slyly ironic deposits. blithely even requests wake blithely bold deposits. fluffily silent theodolites about the 
59712,768376,3833,786.02,"regular, silent packages. slyly unusual platelets nag pending somas. carefully express warhorses detect. slyly final hockey players haggle. packages against the quickly regular excuses "
119625,655942,9579,524.82,iztuicuyrd
4383,6884,1535,258.38,e final pinto beans wake slyly ironically bold instructions. regular accounts boost slyly q
199596,7154,206622,667.38,cqleitanax
93734,3735,8991,88.92,the quickly express packages haggle quickly special pinto beans. blithely bold deposits wake evenly. blithely regular p
20147,5152,4595,623.86,counts above the doggedly bold dolphins haggle bravel
176602,9120,4611,143785.70646759614,eas. finally ironic instructions sleep carefully final instructions. blithely unusual accounts do detect. blithely unusual notornis will
107836,961701,539,229.53,"ecial platelets use slyly after the quickly sly deposits. even deposits haggle-- silent, unu"
17134,178557,9029,241.4, instructions. carefully silent requests use careful
145469,3012,3466,474.1,ckages around the finally final deposits are slyly slyly even theodolites. carefully ironic theodolites run slow deposits. carefully final accounts after the slyly brav
21155,6160,1802,18.86,paxdebeqzi
171521,695859,969834,478864.5039312549,fapwwiocko
189876,455453,4728,561.64,vegnxafbzt
152201,153727,88755,628.74,as. ironic pinto beans sleep carefully. bold instructi
52752,686985,141403,469363.5057223157,zgnhfkvaum
5737,5738,3782,269.71," beans. regular grouches wake ironic, quiet theodolites. bold, silent packages across the idly even accounts wake after the quickly ironic requests."
44246,9255,7626,739.9,"en accounts are closely among the regular, express requests. even dinos na"
9781,7282,2387,201.01,g accounts. furiously pending instructions across the carefu
100954,81213,4423,228015.08078736698,e the regular deposits. carefully ironic deposits cajole never quickly bold Tiresias. quickly thin accounts are across the fluf
96173,860090,999063,810.58,shmwowrcdo
68907,3920,2371,415682.9044582554,niqvlwnsli
112882,919199,766209,779.88, blithely carefully regular packages. even requests could cajole quick
44624,4625,15515,627.61,ts. final excuses along the slyly pending deposits eat according to the theodolites; furiously silent ideas cajole daringly carefully pending dep
130496,3010,5868,324.38,er the blithely silent packages. carefully quick braids according to the ironically bold pinto beans grow carefully furiously even requests. furiously even account
12685,62047,5645,206.42,uriously final excuses sleep idly across the even packages. carefully pe
172226,2227,8059,187.99,"iments are stealthily blithely pending requests. silent platelets hang fluffily blithely special instructions. unusual deposits sleep never. ironic, pending requests boost. "
48474,994228,9559,13573.963953290802,uwvfvjaldj
108108,551310,508889,892.28,ithely even accounts are furiously regular foxes. fluffily unusua
29298,6805,9786,784.47,wake slyly according to the pinto beans. regular deposits above the furiously express pinto beans are blithely slyly unusual packages. unusual deposits run. ironic instru
160153,154,406,956.79,nbjrohioim
131389,8929,5900,253.58,dependencies cajole furiously blithe packages. furiously pending instructions cajole according to the slyly bold pinto beans. regular accounts s
44769,2282,4931,737.57,lyly silent accounts nag daringly even accounts. slyly unusual deposits at the quickly ironic hockey players x-ray blithely foxes. carefully final pinto beans sleep. thin
111479,9013,2984,473.63,ronically according to the unusual packages. furiously final requests haggle? carefully regular theodolites about the carefully express excuses
23297,463638,610177,1.8,"deas are express packages. carefully regular deposits boost furiously. express requests affix ironic, express sentiments. carefully ironic packages nag furiously across the fluffily bold fox"
42680,193,797,721.32,ual deposits was. express theodolites haggle against the quickly regular foxes: closely special ideas wake quickly. blithely express deposits cajole across the enticing
162596,2597,9015,208983.0330811241,ously quickly final instructions. special accounts sleep ca
124672,2209,4224,431.34,y ironic ideas mold carefully. quickly regular packages about the express hockey players wake with the closely silent packages! carefully dogged
138005,3032,1578,818.83,"packages haggle fluffily above the blithely express ideas. even, final deposits breach "
113747,6259,2360,129.26,heodolites according to the slyly even packages sleep slyly theodolites. accounts cajole slyly. quickly even decoys nag furiously. Tiresias among the warthogs nag 
138625,3652,2577,796.28,ully even packages wake blithely. ironic platelets sublate carefully furiously bold accounts. requests abov
87764,7765,3033,862.16,mvkdqldgkl
163376,5893,2902,183367.40632877723,fvxdcxxdjz
134877,4878,9012,465.63,ly regular pinto beans. furiously final pinto beans sleep slyl
179199,468568,956272,748.24,jnpydyhqpo
35784,5785,6094,946.25,yly. slyly fluffy pinto beans alongside of the special theodolites sleep quickly foxes. iron
62974,679940,3042,610100.7141769872,mwkrhzcifb
121592,6617,694,942.11,ly even theodolites. blithely pending platelets nag. packages are ruthlessly after the quickly regular courts. sly
19868,7372,8721,284.43,ve the furiously even ideas. carefully silent ideas
68974,8975,5829,52.38,slyly special requests. pending foxes wake around the fluffily bold ideas. courts a
199927,2447,716988,648.74,fwqmnzahri
107652,7653,8852,60.13,"en platelets mold around the requests. furiously bold accounts above the regular, ironic accounts nag alongside of the slyly even packages. daring accounts must have to"
27377,191358,216,823127.7660453455,"lar pinto beans cajole slyly among the even theodolites. final requests are carefully above the packages. evenly unusual realms alongside of the fluffy, final ideas affix reques"
107926,5457,2689,285.59,eas nag carefully quickly pending asymptotes. regular dinos cajo
20880,8387,9019,811.25,zianjgzvbx
343,2844,5322,242.79,"telets wake blithely ideas. slyly regular packages cajole after the slyly special accounts. carefully express requests are across the express ideas. final packages wake slyly along the express, dar"
150047,2563,1771,323.28,xubmijksif
128184,673913,420921,872983.6597883804,ending dinos. furiously ironic accounts above the furiously regular pinto beans print quickly furiously unusual requests. blithely ironic instructions haggle among the pend
51226,8742,7633,945.98,! regular instructions alongside of the boldly unusual braids affix carefully blithely final requests. furiously even instruction
43474,8483,320755,903.24,hdlidtenrd
65275,2794,2155,329.61,"ithely ironic deposits. blithe, express frets cajole carefully. quickly final accounts haggle quickly. blithely ironic packages are quickly above the slyly "
189317,6872,8820,69.31,slyly special requests alongside of the slyly special packages are blithely whithout the furiously bold platelets-- carefully even accounts cajole carefully according to the care
86708,1725,8387,804.17,ar requests haggle carefully according to the quickly unusual t
55831,842,8099,53820.02168348088,"ss ideas are final realms. blithely regular sentiments sleep within the final, bold deposits. excuses ought to sleep above the quickly ironic pinto beans. quickly regular requests bo"
149355,6898,9275,530.57,pecial requests. pinto beans haggle. slyly unusual sentiments sleep carefully final grouches. permanently 
123373,8398,5816,300.87,ess deposits sleep final deposits. special courts run. unusual accounts haggle above the unusual pinto beans. deposits acr
21551,1552,7210,541.56, the blithely ironic packages! fluffily unusual forges across the requests u
96930,4458,2692,548.54,y. quickly regular deposits haggle carefully slyly bold courts. bold packages must have to haggle slyly against the slyly final ideas. carefully special accounts cajole furi
114170,232688,100844,281.58," unusual forges. pending, final packages haggle carefully carefully bold acc"
68371,145133,686640,906032.7639530343,wmbmovtkfj
190699,599309,4011,856.3,iously even excuses; accounts are fluffily. ironic packages nag quickly about the carefully ironic dolphins. regular asymptotes haggle regular
180976,977,623240,363920.0650976225,usual requests poach carefully final requests. silent packages sleep slyly blithely final excuses. final packages nod. furiously iron
104917,2448,4399,95.33, according to the pinto beans cajole to the even packages-- careful packages sleep throughout the regular packages. furiously regular pinto beans serve aga
18890,6394,426,383.92,ironic packages. slyly unusual excuses cajole accounts. e
136622,1649,481776,59935.8306558726,dkjfmmldpc
72493,593982,143861,295707.766241034,slyly. special deposits nag blithely regular request
131987,7014,9431,222.65,"regular theodolites. ironic theodolites sleep blithely furiously final ideas. regular, regular asymptotes hinder above the special packages. furiously regular foxes nag furiously packages."
108814,975215,2037,901770.7018956391,laeleuyiyn
117645,5179,7768,265.76,ng to the slyly final ideas. blithely unusual dependencies cajole fluffily. fluffily 
106307,777487,499720,329.91,xejpptnrlq
95189,5190,3578,881.34,ts are carefully. ironic deposits after the quickly final decoys nag after th
76367,8875,8322,99.27,"ss theodolites: regular, regular packages haggle quickly carefully special asymptotes. ironic deposits engage blithely against the "
132267,9807,3916,710.73,kages. slyly final waters integrate blithely carefully
163599,6116,8510,232.42,"ggle dogged, final ideas. fluffily even packages use special ideas. furiously regular ideas nag"
21891,457641,2966,423.81,posits. unusual dinos snooze among the slyly even dependencies. pearls wake alongside of the unusual dependencies. even the
107060,602731,677569,504.13,fully silent accounts maintain fluffily along the ironic ideas. stealt
120479,479079,299210,943224.2168744494, requests. blithely ironic platelets sleep slyly even dolphins. idly regular foxes engage slyly. even requests integrate caref
152582,5098,1085,307.9,"ely final dependencies. final, bold accounts wake about the even excuses. pending deposits"
129592,9593,6437,962.81,al dependencies. excuses sleep fluffily. blithely final pinto beans above the blithely regular platelets haggle fluffily ironic 
85029,46,7641,926.21, silent pinto beans wake deposits. regular excuses cajole by the quickly daring deposits. fluffily final gifts play around the slyly pen
93797,1325,9281,222.95,kages affix. regular pains cajole doggedly. fluffily ironic deposits among the carefully bold packages use furiously even requests. furiously q
52903,2904,9043,417.68,"p blithely unusual asymptotes. express, ironic instructions detect blithely. blithely final excuses serve furiously-- silent ideas nod carefully bold platelets"
165336,2885,2784,220288.9791985989,wsgifddbjl
129914,7451,8313,471.61,"refully pending grouches impress blithely accounts. regular, silent instructions haggle blit"
175332,2884,563924,841016.9150941905,accounts play against the quickly unusual instructions. fluffily regular accounts affix. accounts haggle about the carefully pending foxes. blithely even decoys 
25394,7897,3370,756.97,ronic pinto beans cajole. quickly even pinto beans use fluffily slyly pending deposits. fluffily unusual
132832,5346,8599,159.24,requests sleep blithely. ironic deposits sleep. even accounts wake among the ironic theodolites. furiously ironic theodolites are fluffily. fluffily express id
158725,1241,4749,417.61,"ely. carefully pending requests cajole quickly. even packages are quickly regular, stealthy packages. even excuses nag slyly evenly bo"
45529,10714,953663,548113.2631614858,"ously express foxes boost above the quickly even tithes. unusual, ironic platelets cajole furiously. unusual asymptotes are fluffily throughout the unusual pinto beans. furiously silent deposits u"
102976,5487,7180,627.91,"onic accounts are carefully ideas. deposits mold slyly ideas. ironic theodolites affix carefully after the pending, regular platelets. fluffily even packages nag carefully sometimes unusual accou"
41372,3877,203557,131151.64776905562,jole pending pinto beans. furiously regular packages x-ray after the slyly special packages. carefully brave theodolites above the carefully re
64661,756873,485511,710.35,pmikuolngu
57439,760651,797799,359135.3910973307,ebywuxtncg
15440,5441,3978,470.77,"ions. final dependencies mold. pending, even ideas are slyly across the ca"
129388,886850,806148,424.01,"fily regular deposits sleep idly pending, final tithes: special accounts doze slyly regular dolphins. carefully ironic deposits across the even packages use accounts. unusual, final packages"
189738,7293,8107,221.28,"y pending accounts wake. blithely regular packages boost furiously. furiously ironic asymptotes was slyly carefully ironic theodolites. final, final pinto beans wake furiously regular, pending ins"
187335,2372,5602,694.94," after the thinly final requests. fluffily even warthogs about the ideas hang quickly along the even, even dolphins. regular, even somas about "
187658,5213,1452,47.42,aggle furiously express deposits. furiously final packages wake slyly idle deposits.
43605,8981,27521,713.57,biajnbadmt
57684,5200,480,312.95,as. blithely special dependencies according to the fluffily special courts eat furiously regular foxes. final requests slee
53570,6076,1176,452.24,ironic packages are enticingly regular dependencies. accounts about the quickly regular requests nag carefully across the slyly even theodolite
128196,8197,7980,213.73,out the furiously regular requests. slyly stealthy foxes poach. deposits print express packages. furiously special warthogs haggl
9663,9664,6881,538.67,"as boost furiously across the express, bold asymptotes. slyly unusual packages affix slyly after the regular accounts. ironic deposits haggle. blithely final foxes hinder carefully above the re"
117875,387,490160,193.04,le. furiously regular foxes cajole carefully about the slyly special instructions. 
50,245486,1832,565.54,"liers above the dolphins dazzle across the regular foxes. furiously regular packages haggle furiously blithely ironic grouches. ironic, even accounts haggle pending, furious instruction"
74113,4114,6438,117152.79478463237,bjskmvugxk
142276,9819,543489,781211.3881515118,ully. carefully regular requests against the express foxes
25705,888677,5829,64.19,jnzbthrcvw
160307,5340,8904,151.64,sly final accounts along the fluffily ironic deposits are blithely regular pinto beans. furiously express accounts hang. furious
118333,5867,62499,721.83,rezmnvublw
174713,554835,9776,594411.3602736928,ke about the unusual theodolites. carefully pending accounts wake quickly instead of the final accounts. 
71925,6940,2197,864637.5772775313,cqpwwqgbkf
175858,5859,2450,591733.2960500469,ronic pinto beans across the fluffily even pinto beans sleep alongside of the slyly regular accounts. slyly unusual pinto beans integrate permanently final d
197688,5246,752712,342316.09458096133,fajkksrcew
136834,6835,339486,708303.3411480074,ng theodolites wake. ironic packages above the blithely final dependencies thrash among the ideas. dolphins run ironic packages
27015,9518,5991,688.5,"pending accounts poach brave, final accounts. requests solve. asymptotes across the carefully even requests are pending platelets. unusual pinto beans wake against the slyly even theo"
135522,605666,250137,771.43, foxes against the final instructions cajole ironically ironic dolphins. furiously regular platelets snooze. packages could sleep blithely. pending ideas haggle carefully ca
126561,1586,2192,719.42,inal packages are slyly about the furiously final accounts. regular foxes nod fluffily against the fluffily brave packages. blithely even accounts sleep blithely after the requests. ac
57322,9828,5531,816791.3976523109,zgmwtbligy
87042,2059,3087,322.33,"fix regular, unusual courts. ironic, fluffy attainments cajole bravely across the packages. carefully ruthless "
32446,2447,3870,153.47,"the, careful ideas. blithely regular pinto beans against the carefully silent dolphins sleep along the final asymptotes. express deposits alongside of the s"
56256,1267,3897,735.02,"nic, even requests. evenly regular accounts across the blithely regular deposits cajole along the silent ideas. carefully final ideas mai"
192411,993371,941251,909487.658899815,"riously final pinto beans maintain furiously. slyly bold requests nod even pinto beans. regular, ironic theodolites are along the carefully unusual ideas. slyly si"
83604,6113,129,923.54,lly special theodolites use quickly before the slyly pending packages. blithely 
165658,691,7840,483.03,"eep fluffily furiously busy packages. blithely regular pinto beans wake. ironic, silent requests sleep slyly never final"
36594,775854,5715,396.06,rs cajole against the carefully final asymptotes! furiously unusual foxes according to the furiously special deposits haggle along the silent dolphins. slyly
122192,426350,8877,533694.0375217849,vajedxgotu
106259,531907,1008,108.46,ut the close accounts. pinto beans are furiously across the carefully re
120595,596,6684,360.22,ages. requests integrate slyly above the slyly pending packages. quickly unusual excuses wake blithely above the even accounts. deposits sleep about the deposits. carefully ironic excuses affix
147629,7630,9978,358.58,es haggle blithely across the slyly bold instructions. fluffily ironic instructions boost regularly across the furiously bold deposits. unusual platelets lose slyly across the f
50460,461,2400,613.11,counts are blithely pending dependencies. quickly regular depths wake slyly blithely final pinto beans. fluffily ironic requests thrash carefully along the carefully unusu
168323,840,9254,834.72," packages could have to haggle bold, brave instructions"
84641,2166,912567,310512.7113816584,"kly furiously special requests. even, unusual courts sleep quickly furiously "
111900,1901,293,288.77,"ests are quickly alongside of the quickly ironic instructions. final, regular requests haggle slyly carefully regular deposits. furiously even accounts cajole fluffily furiously regular tithes. fur"
66613,219211,8920,253.8,lhhivbzvic
65117,533644,7176,578.26,jclksloujd
