partkey,suppkey,availqty,supplycost,ps_comment
19656,7160,9236,815.5,ix across the fluffily pending ideas. even deposits cajole. slyly bold instructions boost furiously regular packages. final dependencies kindle daringly 
195996,572684,455296,881.6,gmrsvsahlx
169832,506483,9226,729283.8063884939,"e the ironic patterns? ironic, ruthless asymptotes behind the bold, pending instructions play blithely carefully p"
78123,631,8661,793.8,ently regular platelets was fluffily permanently final requests. blithely regular accounts wake furiously ironic
86734,6735,9043,889.35,nvotcajtvq
46016,1025,64173,103.06,"requests nag slyly special deposits: ironic instructions detect fluffily about the fluffily regular packages. regular, pend"
191232,3752,9965,430.02,lites boost blithely along the final accounts? regular packages must nod blithely even ideas. regular dolphins
90124,2634,874,209.97,"cial deposits haggle slowly after the even, even requests. carefully regular foxe"
31457,1458,5985,686.86,ding courts. quickly final attainments about the i
46756,6757,334195,653.08, after the ironically pending theodolites are slyly furiously regular deposits. slyly final e
95815,811790,385528,934652.0749563944,auehxcsswf
75311,326,860313,18136.287759661584,gytdedsbxa
116299,3833,9627,901.28,bold packages wake about the furiously bold pinto beans. furiously ironic deposits are quickly. furiously enticing accounts haggle across the instructions. regular accounts above the blith
52385,550318,3173,197113.82273130186,jbvrjmntgz
142177,756973,186890,272.41,netbsvpoym
28257,278294,1740,629.0,gdagxpfitd
27210,9713,6386,220.64,"ss deposits wake busily. even, even deposits nag ironically special requests. instructions along the slyly final packages wake after the carefully bold theodolites. bold foxes "
100881,217527,676510,40148.95438903077,"final, bold theodolites. special packages sleep against"
179375,6927,9830,92.38,"ckly. accounts wake. silent, special deposits across the quickly pending multipliers cajole among the slyly ironic ideas. blithely ironic theodolites wake"
86629,6630,1285,237.64,r theodolites serve fluffily ironic braids. sometimes ironic instructions cajole across the final foxes! ironic de
180164,148283,5351,703122.8132469619,ywkvjovgbq
64806,9819,2393,402.41,s. furiously idle tithes across the blithely final ideas kindle slyly fluffily special packages. slyly unusual requests ha
30719,3223,8836,72.45,eulhonjkxs
117809,2832,602,715.33,"cajole quickly platelets. sometimes even pinto beans dazzle slyly among the regular, ironic asymptotes. slyly regular pinto beans cajole flu"
67661,168,354,307.16," theodolites grow slyly. final, silent courts nag quickly slyly final ideas. evenly express deposits wake slyly. final asymptotes sleep furiousl"
44226,6731,2263,104.21,packages are carefully carefully ironic patterns. pending requests wake closely according to the i
66650,1663,5518,713.07,"sly ironic theodolites. carefully regular deposits doze. requests about the furiously final sheaves sleep blithely ironic epitaphs. pending packages haggle silent, final requests. even, iro"
51674,4180,6268,596.12," fluffily ironic deposits cajole after the even accounts! express, regular "
155105,7621,4243,404.53,ests. furiously final deposits haggle carefully according to the slyl
47942,2951,1078,781.69,out the quickly unusual accounts. blithely even pinto bean
41596,6605,2385,433.4,structions affix. blithely unusual asymptotes haggle slyly. fluffily final requests sleep. quickly final platele
15440,443,172054,208.73,qkybfcehbx
169020,9021,4137,72.94,"y regular Tiresias. carefully ironic requests haggle whithout the even, final packages! carefully idle theodolites use slyly. slyly ironic dinos boo"
154370,4371,9326,91.88,"e quickly pending deposits kindle after the pending, ironic platel"
56753,9259,6319,590.96,ar ideas dazzle silently above the quickly express instructions. furiously ironic grouches above
110757,8291,435913,175175.45892732812,ven packages cajole furiously ironic theodolites. slyly regular deposits haggle; fu
196407,262432,611293,474.71,cgaqjwkbmv
132994,5508,9092,918.55,ual requests must have to haggle blithely at the furiously final sauternes. blithely express instructions haggle. final theodolites after the brave ideas boost slyly regular id
157076,7077,3959,259913.8798263504,ular packages are furiously. slyly ironic deposits detect slyly pending deposits. blithely bold excuses wake quickly. blithely express foxes affix closely unusual deposits. carefully
179340,9341,2848,357.54,"ic, even ideas. packages cajole furiously slyly regular dependencies: regular excuses "
16462,1465,4161,344.79,hely dogged warthogs. slyly even ideas cajole bravely above the bold deposi
192069,71159,6139,851702.3934435362,"s. ironically pending ideas are. ironic, ironic foxes solve furiously slyly final pinto beans. even request"
21012,6017,7731,398.42, asymptotes are within the permanently pending pinto beans. depende
20212,2715,6002,581.49,ously unusual accounts are quickly carefully bold tithes. furiously ironic requests wake slyly across the final deposits. carefully final accounts sleep carefully amon
93448,8467,6060,797.17,"nusual dolphins. carefully express deposits boost. quickly express requests doubt carefully platelets. bold theodolites wake slyly even, special pint"
166148,3697,5958,758.94,"hely final deposits above the accounts sleep about the final dependencies? furiously express requests boost. foxes according to the final, f"
114203,4204,3072,189.43,"sits cajole. slyly regular packages could nag around the unusual, regular accounts. bold pi"
143916,8945,1538,689.07,"al, special packages. deposits haggle furiously fluffily final accounts. even, unusual packages must have to was bold epitaphs. furiously final packages are furiously regular a"
14747,4748,6357,631.22,"l, ironic packages are. careful foxes boost furiously at the finally pending request"
103768,6279,235854,743469.1856073972,s sleep special asymptotes-- slyly silent packages use according to the fluffy foxes. carefully ironic instructions are across the furiously ruthless requests. furiously final deposits nag around th
112494,7517,6895,826.97,olites about the accounts serve bold packages. slyly regular foxes engage fluffily since the furiously r
90641,5660,5730,141.6,oifofegvse
5594,524833,7223,113056.80103272453,rxieknvpyh
103687,6198,711819,816683.554971833,lly pending foxes. regular waters believe blithely slyly even accounts. furiously final asymptotes across the special ideas detect furiously about the requests! carefully pending packages are furi
191210,1211,94807,977019.9073544742,kgnkkqdcte
9325,978,7835,150168.81071819665,ges. quickly even attainments use furiously carefully express accounts. foxes according to the slyly reg
196410,1449,8556,832.47, beans among the blithely final deposits use against the slyly 
81717,9242,534667,379212.83135077835,xwaspvtutx
74269,1791,2629,354.77,special asymptotes above the enticingly special platelets are before the stealthily r
124046,9071,7371,125.43,"ins wake slyly among the fluffily express requests. pending, regular dolphins nag quickly slyly ironic requests."
116789,1812,4193,471.56,kuxpaubrxv
56385,1396,2129,743.12, furiously ironic theodolites are slyly regular platelets. slyly unusual braid
47169,2178,5503,555.88,"un quickly furiously regular requests. furiously regular accounts are furiously. carefully final packages run. bold, final requests after the"
78369,3384,3444,714424.8480003419,ighjilnrwn
172742,294,5902,121.8,the bold deposits. packages detect close requests. slyly 
110653,3165,6715,553.54,"y express somas according to the ironic, idle deposits mold furiously within the ruthlessly special excuses. regular deposits sleep accord"
147967,450196,4331,812198.7239765387,r courts sleep quickly final accounts. slyly express requests nod furiously carefully even requests. express instructions cajole quickly
21990,9497,5521,731.62,t the fluffily final deposits integrate furiously pending account
134615,2155,3421,144.83,"cross the furiously ruthless accounts. fluffily regular asymptotes wake furiously after the final, final requests. care"
163126,3127,591031,590.62,ly ironic courts. regular pinto beans are carefully special dependencies. ironic packages wake. carefully express packages cajole slyly across the final requests. 
98679,6207,2880,721.96,", close asymptotes wake blithely unusual ideas. dol"
107634,5165,6700,624.37,e near the ideas. ironic platelets among the accounts haggle carefully final accounts! slyly ruthless packages wake above the carefully unusual platelets. even de
2239,7240,8750,871.83,"ainst the blithely pending asymptotes hang by the pending, express foxes. blithely pending deposits sleep about the quickly "
5694,5695,218415,284.76,enticing sheaves integrate fluffily. slyly regular instructions sleep carefully above the pending req
144154,4155,7361,848.83,ly across the courts. carefully ironic excuses above the the
171737,9289,3165,840.49,y final requests are final pinto beans. fluffily regular accounts detect alongside of the unus
142308,9851,9803,582789.0352916865,al packages. unusual accounts haggle carefully! slyly ironic requests cajole slyly among the slyly careful packages
183765,8802,3344,60.44,"ly pending foxes. quickly unusual asymptotes nag furiously alongside of the blithely even theodolites. regular, regular escapades use slyly: ruthlessl"
142213,9756,291178,194.8,yzmkawlgwc
50125,2631,1675,213.08,"even requests. even, express pinto beans integrate blithely among the regular, special packages! quic"
80500,8025,2372,36.76,"le furiously among the foxes. final, regular deposits doubt. fluffily furious requests sleep slyly silent i"
69616,2123,323679,30.38,"ic theodolites. slyly pending packages above the regular, ironic deposits wake fluffily alo"
172115,7150,8368,626.13, unusual pinto beans haggle carefully according to the regular requests. decoys cajole blithely. carefully express pinto beans doubt. requests wa
38451,3458,847552,894.78,"en pinto beans. blithely unusual braids sleep quickly for the requests. enticing, special accounts sleep carefully furiously daring accounts. final"
61673,9192,6035,824187.7310095943,dzmslgbiax
101218,241810,6047,501.1," after the bold, bold deposits. furiously regular ideas above the regular, silent pinto beans cajole final, bold foxes. furiously regular sauternes wake finally. even instructions wake according to "
168675,3708,2543,302.45,aintain blithely alongside of the furiously pending packages. slyly ironic accounts behind the theodolites haggl
181451,1452,680497,784.5,tlhwxgogsr
23272,3273,7845,776.16,dependencies. furiously even instructions boost. silent packages boost slyly about the blithely regular accounts. slyly special deposits haggle carefully across the ex
10539,3041,2323,709.88,"ites nod slyly slyly special courts. slyly express instructions boost against the pending, pending foxes. ironic, final courts along the final deposits hang"
55459,470,2868,820.85, pinto beans sleep furiously. fluffily final platelets would are slyly about the carefully bold 
196861,4419,421711,198208.46548912674,ptotes cajole final accounts. fluffily final courts wake blithely regular
158955,1471,1490,204.64,ithely regular Tiresias cajole slyly. quickly regula
128196,33060,9275,633.52,uests. pending packages use final platelets. blithely bold dinos against the carefully regular requests sublate after the blithely special excuses.
174742,9777,2634,592.27,ntamnpxehw
42619,987367,7439,461.86," ironic, silent dolphins snooze-- final, express packages according to the ideas boost furiously deposits. even, sp"
166278,677204,1857,460.3,bold platelets! excuses use. slyly special pinto beans thrash slyly. pending deposits haggle furiously 
86846,9355,338292,314.34,nding accounts wake. furiously ironic requests cajole. blithely pending accounts wake quickly across the furiously final dinos. f
141912,1913,1843,383.91,nts. furiously bold pinto beans along the express theodolites sleep furiously express dept
8310,689055,111,54.65,ounts according to the fluffily sly requests are furiously quickly pending pinto beans. 
45745,5746,731024,736793.1861945244,egular instructions. careful theodolites snooze furiously. furiously pending theodolites wake quickly about the boldly ironic pinto 
168800,1317,7613,105.86,e even deposits. blithely unusual frays are blithely about the iron
38435,5945,6169,960620.9464552768,ossiadomtb
50814,8330,5748,636.73, affix. courts cajole across the daring instructions! ironic instructions mold packages. slyly regular requests doze carefully. ironic accounts boost above the even requests. quickly ironic deposit
172326,2327,172184,429159.47328931204,awprpbbbut
39890,4897,1559,882.41,s. quickly express asymptotes use. quickly ironic ideas use quickly against the furiously bold accounts. quickly bold theodolites use against the i
84441,9458,910159,51.05,"riously even deposits. fluffily pending platelets cajole blithely. unusual, ironic waters nag above the furiously regular requests. silent accounts wake carefully after the pinto beans: deposits "
169122,6671,831502,230003.40570679412,mxjfqyaqhr
102127,4638,1129,682648.9623792638,xiqtphpnrh
198295,3334,4763,784.28,gulbwwhccj
140419,420,58034,56483.85372544995,ywpkralbdi
157129,4675,9536,358.98,ifhcosacyg
123613,3614,5319,984.3,olites. furiously final accounts wake quickly. ironic requests will have to wake deposits. fluffily
92557,85,857,669.27,"ronic accounts. dogged, special dependencies integrate alongside of the final ideas. furiously regular requests sleep p"
158399,5945,7594,444.73,"counts. pending, regular dependencies are carefully furiously ironic requests. final accounts kindle carefully. carefully unusual requests cajole. carefully slow accounts s"
68290,8291,4610,136.04,d the blithely pending requests sleep along the quickly unusual packages. slyly final accounts
167083,2116,4165,16.18,y even excuses. blithely ironic foxes cajole sometimes alon
8242,3243,8221,761.75,"lly even requests will have to are fluffily ironic ideas. bold, special dependencies wake. enticingly unusual "
63115,8128,167369,814947.783312179,tdrmcitgwz
105435,2966,3649,928.04,al accounts after the carefully ironic foxes detect carefully express excuses. q
116645,6646,3843,74.0,final theodolites cajole furiously slyly ironic deposits-- stealthy pinto beans haggle blithely quickly silent packages. furiously regular packa
65993,1006,9889,468776.79262756713,even dependencies cajole according to the blithely final foxes. regular accounts to the carefully special foxes wake quickly qui
33192,5696,835,552.71,accounts are. fluffily pending hockey players haggle accounts. deposits affix. fu
172211,4729,2362,913.04,metimes ironic requests. warhorses are carefully blithely final requests. carefully even
140021,887692,2051,734.58,ruhfwymzms
1248,6249,8913,113.95,ns sleep quickly along the slyly unusual asymptotes: furiously bold re
63534,252172,502663,713972.2919262785,lwxhaosxji
180583,3102,2556,389.91,"ickly regular ideas are blithely after the furiously express deposits. regular accounts boost carefully slyly ironic asymptotes. even, unusual packages detect slyly slyly unusual"
159762,2278,3164,198.77,re at the carefully ironic asymptotes. furiously ironic dependencies wake blithely. slyly pending asymptotes boost blithely slyly special requests. ironic 
146148,1177,2914,619.86,accounts. sauternes are fluffily platelets. slyly final requests cajole
57320,7321,6817,532.18,s haggle blithely according to the furiously unusual courts
676,677,4834,772.8,hins. quickly silent deposits alongside of the ironic accounts integrate above the blithely ironic deposits. final packages are. silent pinto beans doze quickly. fluf
161617,9166,8093,35.01,ackages. ruthlessly unusual packages above the slyly even foxes are carefully across the carefully brave deposits. slyly regular courts maintain evenly. regular Tiresias sleep 
29690,481072,750468,890865.0468071809,knxrzxnxxu
26103,8606,3060,487.05,ickly about the final asymptotes. brave packages shall have to use fluffily carefully even instructions: final packages are carefully. deposits nag deposits. 
105648,8159,8763,628.33,"ccounts cajole. final, regular accounts among the quickly special foxes haggle quickly regular accounts. express deposits among the carefully regular ideas ha"
26413,3920,3660,382.6,tegrate furiously pinto beans. furiously bold waters
66195,812298,205634,224297.37501709868,srwkytcndy
90114,492713,9253,208192.23198675964,p carefully. final theodolites use furiously. quickly final 
12658,838411,4038,937.16,"es wake against the final braids. regular, silent packages unwind blithely along the furiously ir"
170539,540,4362,423.08, final requests ought to are quickly carefully spec
187030,4585,399,31.03,t the deposits-- carefully even pinto beans wake. slyly permanent requests are. carefully ironic requests a
51596,4102,1409,18.71,ges haggle against the final accounts. blithely ev
13870,79550,316479,724.0,koxjgbwswu
26947,4454,9786,378.65,fter the quickly even dependencies cajole furiously ironic ideas. slyly regular platelets above the blithely special deposits boost slyly fluff
177451,5003,2281,212.51, instructions. finally regular requests above the requests detect along the bold packages: ironic accounts are quickly fluffy theodolites. even deposits according to the carefully even 
32379,2380,9924,827.12,rts? regular theodolites promise blithely final accounts. regular pinto beans grow. courts mold slyly furiously bold accounts. instructions aft
114163,787385,1341,669.78,ozibvfipmz
15858,725716,9199,39.68,ccounts. carefully express hockey players along the packages affix slyly even asymptotes. furiously even notornis around the slowly quick foxes int
137623,137,8317,895.69,ully final dinos after the slyly even requests use across the fluffily special deposits. idle requests according to the slyly final pa
92870,398,1359,909.79," against the deposits wake blithely regular requests. furiously regular foxes boost along the carefully express multipliers. brave, ironic platelets nag slyly alongside of the busily bo"
51923,1924,9412,211516.664686481,aaybtqtfqc
40225,7738,4308,808.26,lyly even pinto beans. excuses cajole quickly according to the bold instructi
28531,6038,2363,971.23,gular ideas. ironic ideas wake about the bold deposits: final dolphins doubt furiously along the bold accounts. carefully final asymptotes sle
51395,566043,4462,788356.7020882504,xgvujatxaa
22862,2863,6224,487.93,accounts cajole blithely regular dependencies. careful
85508,5509,349669,458083.75029617356,qtqcmsxqlf
111876,9410,104324,713694.225010395,efully even accounts. slyly unusual accounts sleep furiously bold dinos! express deposits wak
44763,2276,4811,689.37,eposits. permanent requests are against the final requ
170759,549120,696732,969.5,ailwteomgw
127087,7088,3504,872.22,"ve after the furiously silent deposits. slyly even asymptotes haggle quickly according to the regular requests. express, quick theodolites ca"
185764,8283,5163,217.95,". slyly final theodolites detect slyly even packages. ironic, unusual tithes are slyly according to the furiously ironic deposits. doggedly silent packages was carefully final instructions. cou"
30711,712,4157,511.72,hely blithely special realms. quickly unusual requests need to wake blithely ironic i
40744,729008,7867,203.08,vvuiujtyvl
101417,3928,6038,335160.8062156266,"long the bold, bold requests. thinly unusual theodolites among"
7685,186,9256,580.38,ts. blithely pending sauternes use furiously around the blithely sile
147245,4788,8780,42.82,s about the even dependencies are carefully pending asymptote
151343,8889,5131,580.2,"inal ideas. unusual requests sleep furiously across the furiously silent packages. slyly express foxes wake around the blithely express requests. regular, iro"
194622,9661,7120,919.28,"aggle furiously pending, special theodolites. ironic ideas sleep slyly: fina"
184406,1961,1611,474.81," excuses according to the bold theodolites wake slyly even, regular pinto beans. carefully regular packages wake. blithely ironic deposits haggle regular, final deposits. pinto beans ac"
130036,5063,9892,439.18,iously unusual ideas use slyly. regular requests solve regularly. slyly regular requests boost furiously blithely final deposits. carefully regular deposits haggle blithely. special accounts hi
181275,31678,1779,747.01,c accounts run carefully against the carefully pending platelets. pending forges nag carefully. thin dependencies haggle thinly. dependencies doubt ruthlessly final dependencies. blithely bo
58321,827,1114,291.11,ve the slyly special deposits. furiously special pinto beans cajole. quickly unusual foxes haggle. theodolites maintain across the regular 
126544,6545,7872,346.74,. quickly ironic pinto beans according to the slyly regular deposits wake carefully pending asymptotes. thinl
165801,608105,494610,1257.3010290872767,"e. regular platelets boost. furiously pending ideas use. regular, even deposits wake blithely final requests. even packages"
161321,3838,7553,904.75, the slyly regular accounts. final theodolites about
22729,5232,5086,679.95, requests sleep blithely ironic packages. carefully special foxes are furiously. slow 
171566,4084,878895,975412.4608463565, accounts use blithely quickly final accounts. carefully ironic ideas mold after the quickly unusual requests. packa
154331,4332,4832,967.92,"xes hang among the furiously ironic packages. slyly bold accounts cajole; packages along the instructions are among the even, pending foxes. quickly regular deposits about the regular, ironic "
181331,166926,7349,118378.28399718898,ptlpzuktsg
160010,43962,1274,818.02,tzgjpjgmto
151001,6032,9065,114.95,"counts. furiously pending ideas unwind always furiously regular requests. silent, ironic platelets detect alon"
3836,3837,5302,316.41,"regular, bold theodolites sleep furiously. forges according to the accounts wake c"
96896,1915,2826,489.67,nic packages. carefully unusual packages boost. regular packages impress furiously. quietly ironic instructions according to the slyly regular foxes play carefully according to the depos
161548,1549,711745,208.69,rdqocdkgcj
183174,3175,7197,661847.8924885604,rqaiowxdyr
169765,2282,1183,515.72,ar requests sublate above the slyly pending deposits. regular multipliers boost across the bold excuses.
65693,5694,6757,298.45,ully furiously even requests. bold instructions sleep slyly care
23923,8928,700312,406604.1431537601,"l accounts across the even, pending pinto beans boost along the ironic, fluffy foxes. regular ideas haggle foxes. furiously even requests haggle carefully regular packages. slyly even the"
123995,947602,602,669579.9690457173,lejhenytkl
125074,99,1751,531.96,"sts. final, bold dependencies wake. ironic, ironic packages grow quickly furiously even asymptotes. furiously regular dolphins x-ray alongside of "
11190,650901,530809,386166.21717564715,tkcnqldxfg
192505,2506,4555,651.3,ular packages haggle slyly blithely unusual foxes. furiously express dependencies engage according to the regular excuses. blithely pending id
95582,5583,5402,752.3,sly regular accounts. bold accounts wake blithely above the slyly
113405,5917,1742,952.55,special dependencies sleep carefully along the regular accounts. quickly unusual pinto beans affix carefully dependencies. b
89165,321808,2314,797.73,lfobafcnoq
173242,8277,9767,169.46, packages thrash furiously; furiously pending asympto
98485,122734,595476,110792.66743171646,es are carefully about the carefully ironic platelets. regular instructions sleep carefully. furiously special pinto beans detect according to the carefully final deposits. special acc
4641,4642,2859,936.77, slyly final multipliers. carefully final tithes among the fluffily careful deposits haggle against the blithely final account
81320,955735,164045,635.79,pxfflkkkwc
37254,4764,9556,105.41,"ight serve carefully quickly ironic requests. thin, pending pack"
45893,5894,1639,229.05,ges-- carefully pending ideas wake never ironic requests; ideas are. packages sleep fluffily except the carefully quick deposits. furiously even gifts above 
67536,7537,537385,794143.1951565661,"eans haggle quickly regular deposits. instructions sleep final deposits. quickly ironic platelets use carefully about the quickly special instructions. bold accounts use ironic, express Ti"
82882,7899,2523,392.43, special requests. furiously bold ideas use blithely furiously final deposits. slyly final instructions about the pending packages wake about the slyly final platelets. carefully express theodolit
3622,291877,374905,807055.3846077839,"refully regular, special instructions? platelets wake quickly? carefully final excuses use. fluffily pending packages above the quickly unusual foxes sleep after the packages. express re"
58588,1094,7074,593.93,ges: unusual instructions dazzle. pending dependencies about the accounts eat slyly around the furiously regular 
141559,1560,679,606.38,uriously. quickly regular pinto beans above the ironic deposits haggle al
194118,4119,1492,802.58,l requests use slowly bold packages. even ideas use about the slyly unusual ideas. carefully ironic ideas was alongside of the package
134137,793717,1203,773.01,"ses nod blithely blithely final instructions. slyly ironic deposits affix carefully among the ironic, regular accoun"
128223,5760,3921,427.5,he slyly special accounts need to cajole alongside
152456,2,8602,538.32,"deposits unwind quickly upon the fluffily silent foxes. quiet accounts integrate carefully even accounts. unusual, pending instructions cajole care"
85844,5845,3408,635.64,"uests wake slyly. furiously pending pinto beans wake blithely. furiously silent dolphins are. ironic, regular requests against the fluffily bold requests haggle idly against the bold "
